Position,Company_Name,Location,Post_Month,Post_Year,Details
DLP Analyst,DLP Analyst,AstraZeneca,May,2024,"About The AstraZeneca

AstraZeneca is a global, innovation-driven biopharmaceutical business that focuses on the discovery, development, and commercialization of prescription medicines for some of the world's most serious diseases. But we're more than one of the world's leading pharmaceutical companies.

At AstraZeneca, we're proud to have an outstanding workplace culture that encourages innovation and collaboration. Here, employees are empowered to express different perspectives - and are made to feel valued, energized and rewarded for their ideas and creativity.

About The Team

Enterprise Technology Services (ETS) are a global team that are accountable for many of the IT tools and services that directly chip in to the effectiveness of our AstraZeneca colleagues.

We partner locally in more than 60 global business sites for service delivery and IT experience and are accountable for all infrastructure, cybersecurity, IT operations and End User services and technologies.

ETS also handles many of the large IT contracts at AZ, as well as partnering with large organisations on behalf of AZ to deliver value and innovation through new and existing capabilities and services.

About The Role

Cybersecurity Defence Operations (CSDO), which sits within ETS, is fundamental to enterprise information security and responsible for detecting, analysing, and responding to real or potential security incidents. The Data Loss Prevention (DLP) Analyst specializes in the collection and analysis of data loss incidents to proactively identify and mitigate potential data breaches at AstraZeneca. The DLP function empowers operational decision-makers to a) respond more effectively to data loss incidents through informed decision-making and b) implement measures to mitigate or close gaps in defence, thereby preventing data breaches from occurring in the first place.

The DLP Analyst will be accountable for:


Use the SIEM solution to analyse data loss incidents from diverse sources, generating actionable insights including rapid alerts, dashboards, and reports.
Monitor and Investigate alerts generated by DLP systems to support investigations to figure out root cause and severity of potential data breaches.
Continuously monitor user activities and data transfer patterns to detect any deviations from normal behaviour that may indicate insider threat activities.
Implement anomaly detection mechanisms to automatically identify suspicious user behaviour and generate alerts for further investigation.
Collaborate with relevant support team to gather data to support investigations into potential Data Loss incidents, security incidents, insider threats, and legal discovery requests.
Generate reports and metrics on DLP incidents, trends, and effectiveness of controls for management and partners.


Requirements

Essential


At least 1 to 3 years’ experience in Data Loss Prevention
Degree in Information Security, Cyber Security, or relevant experience
Familiarity with Security Technologies (Endpoint Detection, SIEM, Office 365 product etc.)
Familiarity with Data Loss Preventions tools such as ZScaler, Microsoft Purview, Amazon Macie etc.
Adaptability and a willingness to learn new technologies and methodologies to stay ahead of evolving data loss threats and prevention strategies.
Integrity and professionalism in handling sensitive information and maintaining confidentiality throughout data loss investigations and incident response activities.


Desirable


A background in either Cybersecurity Operations, eDiscovery, or Access Management
Familiarity with Splunk
A natural curiosity towards investigative analysis, with a proactive approach to uncovering potential data loss incidents and proclivity to ask why and delve deeper into the root causes of data security incidents, enabling comprehensive understanding and effective resolution.
Superb communication and social skills to collaborate efficiently with multi-functional teams and communicate technical concepts to non-technical partners.
Excellent written and verbal communication skills in English
Experience with Data Loss Protection controls and collaboration with collaborators to develop and implement DLP policies and procedures tailored to organizational requirements.


📌Strong English Communication Skills Required.

📌 Positions are open to Mexican Citizens and official residents of Mexico.

📍 Location: Guadalajara (hybrid - Expectation of working in the office 3 days a week)

When we put unexpected teams in the same room, we unleash bold thinking with the power to inspire life-changing medicines. In-person working give us the platform we need to connect, work at pace and challenge perceptions. That’s why we work, on average, a minimum of three days per week from the office. But that doesn’t mean we’re not flexible. We balance the expectation of being in the office while respecting individual flexibility.

Why AstraZeneca?

At AstraZeneca when we see an opportunity for change, we seize it and make it happen, because any opportunity no matter how small, can be the start of something big. Delivering life-changing medicines is about being entrepreneurial - finding those moments and recognising their potential. Join us on our journey of building a new kind of organisation to reset expectations of what a bio-pharmaceutical company can be. This means we’re opening new ways to work, pioneering cutting edge methods and bringing unexpected teams together.

Interested? Come and join our journey.

So, what’s next!

Are you already imagining yourself joining our team? Good, because we can’t wait to hear from you.

Where can I find out more?

Our Social Media:

Follow AstraZeneca on LinkedIn https://www.linkedin.com/company/1603/

Follow AstraZeneca on Facebook https://www.facebook.com/astrazenecacareers/

Follow AstraZeneca on Instagram https://www.instagram.com/astrazeneca_careers/?hl=en

AstraZeneca is an equal opportunity employer.

AstraZeneca will consider all qualified applicants for employment without discrimination on grounds of disability, sex or sexual orientation, pregnancy or maternity leave status, race or national or ethnic origin, age, religion or belief, gender identity or re-assignment, marital or civil partnership status, protected veteran status (if applicable) or any other characteristic protected by law. AstraZeneca only employs individuals with the right to work in the country/ies where the role is advertised."
Complaints Analyst,Complaints Analyst,Genpact,June,2024,"As a Complaint Analyst, you will play a pivotal role in ensuring customer satisfaction by meticulously gathering and analyzing all pertinent information related to customer dissatisfaction. Your responsibilities will include accurately documenting complaints, conducting thorough investigations, providing clear and timely feedback to customers, and initiating appropriate compensation measures. Additionally, you will collaborate closely with various departments to drive continuous improvement initiatives based on complaint data analysis.

Responsibilities:

Enter, monitor, follow through, and report on all complaints, including those related to service, quality, and accommodation, in accordance with established business procedures.
Perform detailed root cause analyses for customer care-related complaints and initiate appropriate corrective actions.
Monitor and ensure timely resolution of complaints, maintaining alignment with customer care agents and sales teams.
Conduct comprehensive investigations to gather, validate, and understand all factors contributing to customer complaints, including service, quality, and accommodation issues.
Identify preliminary root causes and determine the responsible department for further analysis.
Delegate root cause analysis tasks to relevant departments and ensure timely follow-up on feedback.
Formulate clear and concise responses to customers based on feedback from responsible departments, ensuring alignment with customer care agents and sales teams.
Monitor and track feedback provided to customers, ensuring timely resolution and satisfactory outcomes.
Proactively follow up with customers to ensure that their complaints are being effectively addressed and resolved to their satisfaction.
Enter credits/debits/returns into SAP once final approval has occurred.
Support ongoing efforts to prevent the recurrence of complaints by actively participating in continuous improvement initiatives.
Collaborate with relevant stakeholders to implement process enhancements and drive improvements based on complaint data analysis.
Generate comprehensive reports on complaint trends and analysis to drive continuous improvement projects.
Utilize data-driven insights to identify opportunities for enhancing service quality, operational efficiency, and customer satisfaction.

Scope:
Customer based in Mexico, United States of America, and Canada
Travel requirements: <5%



Qualifications we seek in you!
Minimum Qualifications
Bachelor’s degree or equivalent work experience
Minimum of 3 years of experience in a Customer Service role
Fluency English; proficiency in French required for representatives handling Canadian customers
Strong preference for experience in the manufacturing industry or B2B environment
Salesforce.com and SAP experience preferred
Ability to troubleshoot and manage multiple priorities in a fast-paced setting
Influences and persuades others and builds consensus through give and take
Independent thinker with a collaborative spirit, dedicated to achieving collective goals
Exceptional customer focus and adept at building strong relationships
Motivated self-starter with the ability to manage deliverables through a team environment
Solution-oriented mindset with keen attention to detail
Holds self and others accountable for results
Effective communicator capable of interfacing with various levels of management


Additional Skills
Excel or Google sheets experience (formulas, pivots, etc)
Active listener with a commitment to excellence.
Analytical and technically proficient.
Collaborative team player with strong interpersonal skills.
Ability to multitask effectively and transfer knowledge to others.
Strong planning skills with a positive outlook.
Supportive of team members and organizational goals."
Analyst,Analyst,O'Connor Capital Partners,June,2024,"Analyze, supervise, and execute on business plans across the portfolio of investments the company currently advises on.

 Key Roles Responsibilities

 Supporting the local team in day-to-day activities related to the portfolio.

Analysis of budgets, taxes, leasing, income, expenses, capital improvements, debt, etc.
Analysis and assistance for the preparation of third-party valuations.
Prepare and maintain detailed financial models with forecasts of cash flows.
Assist in analyzing and coordinating placement of insurance.
Assist in preparing quarterly investor reports.
Analyze and prepare any financial, operative, or administrative reports as required.
Supervise major capital investment projects.
Research, monitor and report on market and industry data.
Assist in preparing recommendations for management committee as required.
Build relationships with stakeholders within internal and external teams.
Prepare analysis and presentations regarding any company initiative.
Assist team in any general business requirements.

About you
Interested in developing a career within institutional real estate investment management.
Ideally with a degree in finance, economics, management, or engineering.
The candidate will be a hardworking, highly ethical individual with strong self-initiative, fast learner, able to perform with reduced supervision.
Previous knowledge in financial modeling.
Proficient in Excel, Power Point, Word.
Excellent oral and written communication skills.
Fully proficient in English and Spanish.
 Please note that this job placement is in Mexico City, and thus we can only accept applications from candidates who are eligible to work full-time in Mexico (i.e. Mexican nationals)."
Analista de Prevención de Lavado de Dinero,Analista de Prevención de Lavado de Dinero,Citibanamex,May,2024,"The Execution Analyst 2 is an intermediate position responsible for performing risk and compliance reviews in coordination with the broader Anti-Money Laundering (AML) team. The overall objective is to utilize in-depth AML knowledge to review, analyze and conduct effective due diligence and investigations on higher risk cases that may be a potential risk to Citi.

Responsibilities:

Conduct investigations and research on potentially suspicious clients using various internal and external systems and databases
Conduct Cross Sector reviews among multiple Citi business lines.
Document and report the review/investigation findings and prepare case files with the required supporting documentation
Summarize, in writing, clear and concise findings of the investigation
Advise senior management on next steps and provide recommendations on the next course of action (relationship retention, termination, Suspicious Activity Report (SAR))
Assist AML team with managing risks by analyzing the root cause of issues and impact to business
Appropriately assess risk when business decisions are made, demonstrating particular consideration for the firm's reputation and safeguarding Citigroup, its clients and assets, by driving compliance with applicable laws, rules and regulations, adhering to Policy, applying sound ethical judgment regarding personal behavior, conduct and business practices, and escalating, managing and reporting control issues with transparency.

Qualifications:

0-2 years’ relevant experience
Knowledge of AML regulations preferred
Proficient in MS Office
Excellent verbal and written communication skills
Demonstrated analytical skills

Education:

Bachelor’s/University degree or equivalent experience

This job description provides a high-level review of the types of work performed. Other job-related duties may be assigned as required.

------------------------------------------------------

Job Family Group:

Compliance and Control

------------------------------------------------------

Job Family:

AML Execution

------------------------------------------------------

Time Type:

Full time

------------------------------------------------------

Citi is an equal opportunity and affirmative action employer.

Qualified applicants will receive consideration without regard to their race, color, religion, sex, sexual orientation, gender identity, national origin, disability, or status as a protected veteran.

Citigroup Inc. and its subsidiaries (""Citi”) invite all qualified interested applicants to apply for career opportunities. If you are a person with a disability and need a reasonable accommodation to use our search tools and/or apply for a career opportunity review Accessibility at Citi.

View the ""EEO is the Law"" poster. View the EEO is the Law Supplement.

View the EEO Policy Statement.

View the Pay Transparency Posting"
Analista de monitoreo,Analista de monitoreo,GM Sectec,June,2024,"¿Eres recién egresado de la universidad y apasionado por las redes, la informática y la computación? ¡Tenemos una oportunidad perfecta para ti!

¡Estamos buscando talentos frescos y motivados para unirse a nuestra familia!
¿Por qué GM Sectec?
Somos una empresa líder en el sector de ciberseguridad en donde no solo valoramos el talento, lo cultivamos. Ofrecemos un entorno de trabajo dinámico, oportunidades de crecimiento y un equipo colaborativo que te apoyará en cada paso del camino.

Como Analista de Monitoreo tus principales funciones serán:
Atender todas las activaciones generadas por los sistemas de alarma. Validar activaciones mediante el uso de videos.
Cumplir con todos los protocolos establecidos.
Nosotros te brindaremos la capacitación.
Disponibilidad para turno mixto y nocturno.
Mixto: 2:00 p.m. -10:00 p.m.
Nocturno: 10:00 p.m- 6:00 a.m.

Requisitos:
Recién egresado de carreras como Ingeniería en Redes, Ingeniería en Informática, Ciencias de la Computación, o afines.
Responsabilidad y compromiso
Habilidad en informática y computación.
Actitud proactiva y ganas de trabajar en equipo.
Trabajo presencial (área Polanco)

Nosotros te ofrecemos:
Sueldo Competitivo
Seguro de gastos médicos mayores pagado por la empresa.
Seguro de vida pagado por la empresa.
Vales de despensa
Aguinaldo: 1 mes de sueldo
Vacaciones: 12 días primer año.
Capacitación continua

Si cumples con los requisitos y te interesa formar parte del equipo GM Sectec, envíanos tu información.
¡No dejes pasar esta oportunidad y comienza tu carrera profesional con nosotros!"
Junior Analyst,Junior Analyst,Lottus Education,May,2024,"Vacante – Analista de Proyectos Digitales 

¿Quiénes somos? 

Lottus Education es una plataforma de inversión privada mexicana, especializada en el sector educativo. Actualmente, la plataforma de Lottus está compuesta por 6 marcas con presencia a nivel nacional y con más de 85,000 estudiantes. Lottus está creciendo aceleradamente, con el objetivo de convertirse en la plataforma de educación privada líder en México. Nuestra misión es lograr un cambio de alto impacto en la calidad de la educación en México y poder impactar la vida de miles de mexicanos.  

Somos una empresa en busca del mejor talento disponible, sin importar tu contexto. Estamos buscando gente que este sumamente motivada en crear un gran impacto en México y que busque crecimiento exponencial en su carrera profesional trabajando y aprendiendo directamente del CPO y la alta dirección.  

¿Qué buscamos? 

Profesionistas con hasta 2 años de experiencia laboral 

Formación con enfoque cuantitativo y digital: Ingenierías, computación, actuaría, matemáticas aplicadas y afines. 

Capacidad para: 

Abordar y resolver retos de negocio que requieran un análisis comprehensivo del problema 
Combinar métodos de análisis cualitativos y cuantitativos para genera un mejor entendimiento de la problemática y tomar decisiones informadas antes de proponer cualquier solución tecnológica o digital 
Tomar decisiones de manera asertiva y eficiente, priorizando el impacto al negocio y al usuario 
Realizar análisis financieros básicos, enfocados en analizar la viabilidad y rentabilidad de casos de negocio de proyectos digitales y tecnológicos 
Seguimiento y coordinación de equipos multidisciplinarios 
Analizar, construir y dar mantenimiento a bases de datos en Notion.so 
Gestionar tiempo, recursos y personas 
Realizar presentaciones ejecutivas para la alta dirección 
Habilidades y conocimientos: 

Gran iniciativa, proactividad y estilo de trabajo orientado a resultados 
Comunicar resultados en foros de alta dirección, en español e inglés 
Interés en los procesos de negocio, con un fuerte enfoque en la optimización de los mismos a través de la tecnología y diseño de soluciones 
Competencia superior en Microsoft Office (Excel, PowerPoint y Word) 
Competencia intermedia en Notion.so (preferido) 
Conocimiento de la herramienta Viva Goals (preferido) 
Conocimientos y gusto por la tecnología y los negocios digitales 
Habilidades de diseño y/o programación (deseable más no obligatorio) 
Descripción del trabajo 

Principal interlocutor entre los líderes del equipo de producto, tecnología, data y los directores generales de las marcas de Lottus y los directores de las áreas funcionales en el corporativo. 
Coordinar la planeación, ejecución y despliegue de proyectos e iniciativas transversales entre marcas y áreas de Lottus. 
Responsable de la mejora continua en los procesos internos del área, planteando iniciativas de mejora de la eficiencia de los equipos y la entrega de productos y proyectos. 
Corresponsable de la gestión del cambio derivada de la implementación de nuevas soluciones, procesos, productos y sistemas. 
Ser embajador de la digitalización en Lottus y la operación de las universidades. 
Trabajar con el equipo de alta dirección para marcar el ritmo en el seguimiento de proyectos, recopilación y entrega de información crítica para el negocio, implementación de soluciones, realización de análisis y presentación de resultados del área, entre otros. 
Interesados/as compartir su CV a jose.nava1@lottuseducation.com (CC: andres@lottus.com), poniendo como asunto del correo el nombre de la vacante. "
Remote Analyst,Remote Analyst,Jules,May,2024,"Hi there! We are Jules and our client is looking for a Remote Analyst!

This position is open for people residing in LATIN AMERICA**

About The Company

Our client seeks to acquire and grow companies for long-term success. With a timeline of 18 to 24 months for the first acquisition, our team comprises two full-time partners based in New Jersey and Los Angeles, alongside interns and offshore support roles. Our culture is fast-paced, results-oriented, yet fun and kind, emphasizing good vibes and achieving goals.

About The Position

As a Remote Analyst you will be responsible for gathering, analyzing, and interpreting data to provide actionable insights that drive strategic decision-making.

Responsibilities

Conduct high-volume lead generation using databases and online resources
Vet and organize target company data for email outreach
Customize template emails to acquisition targets
Summarize business descriptions for various industries
Assist with meeting scheduling and other related tasks

Requirements

Excellent written and oral English communication
Ideally two or more years in a relevant position
Bachelor's degree in Business, Finances, Economics or related is a plus. Exposure to business concepts is preferred
Strong Excel proficiency: formulas and functions (such as IF, VLOOKUP, etc), familiarity with Excel's built-in tools for data analysis, such as PivotTables, PivotCharts, Data Tables, Conditional Formatting, Charts and Graphs, etc
Familiarity with Google Workspace or quick learning ability
Experience working remotely for US-based companies
Experience with email sales efforts or Customer Relationship Management (CRM) systems is highly advantageous
High-energy and efficient in operative tasks
Candidates should have a strong analytical mindset, with the ability to think critically, identify patterns and trends in data, and generate insights that drive business outcomes.

Compensation And Benefits

Competitive salary
Paid digital subscription to Wall Street Journal or Financial Times.
PTO: Up to 10 days annually for holidays, additional 10 days after 90 days of employment.

If this opportunity sounds good to you, send us your resume!"
ANALISTA MULTIPLES VALIDACION (TEMPORAL) // OS MX,ANALISTA MULTIPLES VALIDACION (TEMPORAL) // OS MX,Coca-Cola FEMSA,May,2024,"Somos Coca-Cola FEMSA (KOF), el embotellador y comercializador más grande del mundo por volumen del sistema Coca-Cola. Diariamente servimos a más de 381 millones de personas en Latinoamérica. Nuestros más de 80 mil colaboradores nos permiten representar a más de 169 marcas líderes en los diferentes territorios donde tenemos presencia. En Coca-Cola FEMSA, cada día es una oportunidad para aprender y crecer. ¿Te gustaría ser parte de nuestro equipo?

ANALISTA MULTIPLES VALIDACIONES (TEMPORAL) // OS MX

Estamos buscando candidatos internos para la posición de ANALISTA MÚLTIPLES VALIDACIONES (TEMPORAL) del área Logística de División México.

Misión Del Puesto

Asegurar la programación y ejecución de envío de productos para el abasto de los Centros de Distribución especializados de Valle de México, satisfaciendo el nivel de servicio y atención operativa desde plantas locales y foráneas.

Responsabilidades Del Puesto

Validación y ejecución de PDF para asegurar la cobertura de la demanda de los Centros de Distribución especializados de Valle de México.


Actividades Del Puesto

Validación de críticos en las 3 validaciones de los diferentes formatos de abordo. Diurnas, Nocturnas, BAEs, Aeropuesto, TDC, Autoservicios, Mixtas y Diamante.
Gestión de críticos no programados buscando alternativas de abasto desde plantas alternas.
Operación en sitio reforzando comunicación y procesos para coordinación del abasto.
Reporte de seguimiento de críticos por validación y confirmación de desabasto.


Requerimientos Del Perfil

Formación: Nivel Licenciatura (Ing. Industrial o carrera afín)
Experiencia deseable/ requerida en las siguientes áreas: - Experiencia +1 año en puestos similares


Conocimientos técnicos: 'Excel Intermedio, SAP, ESP, TM, BW, Power BI, Power Point Intermedio

Habilidades: Negociación, Liderazgo, Gestión de equipo, Comunicación asertiva

Consideraciones especiales: Horario de 7:00 a.m. a 4:00 p.m.

Esquema Híbrido (3 presencial / 2 HO)

LA POSICIÓN ES TEMPORAL, DE UN PROYECTO DE 3 MESES DE JUNIO A AGOSTO*


Si cumples con los requisitos de puesto y tu objetivo es aprender, crecer y desarrollar una carrera plena de desafíos, te invitamos a enviarnos tu postulación. En Coca-Cola FEMSA consideramos firmemente que el Talento es la clave para el éxito. Es por ello que estamos comprometidos en ofrecer las mismas oportunidades de desarrollo para todos los candidatos sin diferenciación de origen, raza, estado civil, edad, opinión política, género, credo, asociación a una cultura o afiliación a un sindicato, clase social o económica, situación familiar, embarazo, lengua, orientación sexual, identidad de género, discapacidad, enfermedad, nacionalidad o estatus migratorio y/o cualquier otro motivo. Valoramos la diversidad, ya que sabemos que nos hace más fuertes. En FEMSA, Coca-Cola FEMSA, OXXO, FEMSA Empaque y FEMSA Logística, TODOS los procesos de reclutamiento y selección de personal son GRATUITOS para todos los postulantes."
