Position,Company_Name,Location,Post_Month,Post_Year,Details
Analista de Seguridad de la Información EDR,Seguridad de la informacion,"Monterrey, Nuevo León, Mexico",May,2024,"En Axtel nos reinventamos, nos transformamos y nos adaptamos a través de nuestra pasión: La innovación.  
 Queremos integrar a nuestro equipo a un Analista de Seguridad de la Información EDR 
  Objetivo. Mantener la confidencialidad, integridad y disponibilidad de la información de los clientes, creando las condiciones necesarias para minimizar los riesgos de seguridad aplicables, mediante el análisis y la respuesta a eventos e incidentes de seguridad. 
  Requisitos: 
Carrera en Seguridad en TI, Ciberseguridad, Electrónica y Comunicaciones, Sistemas o afín 
Conocimiento y manejo de Microsoft Defender
Experiencia en monitoreo y análisis de incidentes de seguridad  
Disponibilidad de Rotar turnos 
 Te ofrecemos: 
- Horario rotativo mensual 7am- 5pm / 2pm-11pm / 11pm-7am (incluye fines de semana)
- Modalidad híbrida 
- Contrato directo y esquema 100% nominal 
- Prestaciones Superiores a las de Ley
 ¡Excelentes beneficios para tu salud y bienestar, tu economía y balance con tu vida te están esperando para que disfrutes de ellos a cambio de tu contribución! 

Al participar en nuestros procesos de selección apruebas el tratamiento de datos que se describe en el Aviso de Privacidad en nuestra página. Te invitamos a consultarlo. "
Information Security Solution Analyst,Information Security Solution Analyst,Takeda,May,2024,"By clicking the “Apply” button, I understand that my employment application process with Takeda will commence and that the information I provide in my application will be processed in line with Takeda’s Privacy Notice and Terms of Use. I further attest that all information I submit in my employment application is true to the best of my knowledge.

Job Description

The Future Begins Here

At Takeda, we are leading digital evolution and global transformation. By building innovative solutions and future-ready capabilities, we are meeting the need of patients, our people, and the planet.

In this role, you will have the opportunity to boost your skills and become the heart of an innovative engine that is contributing to global impact and improvement.

At Takeda we Unite in Diversity

Takeda is committed to creating an inclusive and collaborative workplace, where individuals are recognized for their backgrounds and abilities they bring to our company. We are continuously improving our collaborators journey in Takeda, and we welcome applications from all qualified candidates. Here, you will feel welcomed, respected, and valued as an important contributor to our diverse team.

The Opportunity

Provides architectural guidance to IT and business stakeholder and serves as domain expert and designer for information security solutions
Aligns implementations of security best practices with a team of information security and IT specialists within their areas of specialization and ensuring best information security practice implementations.
Supports and the information security strategy with IT stakeholders for areas of responsibility.
Analyses the current information security environment to detect critical deficiencies and researches / evaluates alternative solutions while weighing costs, complexity, and industry best practices to provide recommended solution within area of responsibility.
Collaborates with global Enterprise Architecture team on broader architecture topics, processes, technologies

Accountabilities

Supports the security strategy with IT and business stakeholders within areas of responsibility through managing application security assessments, supporting vendor security reviews and secure application solutioning and design
Collaborates with other Security and non-Security Architects to ensure technological alignment of security solutions across multiple domains.
Supports the deployment of new information security solutions with architectural expertise and guidance.
Analyses the current information security environment to identify gaps or opportunities for optimization
Resolves unique and complex IT information and security architecture problems
Collaborates with other security functions, the PMO (Project Management Office) and Service Delivery functions on the delivery of IT projects
Develops and manages relationships with global and regional IT and vendors
Manages and resolves issues and escalates them appropriately

DIMENSIONS AND ASPECTS

Geographical Scope is global, however main focus would be US and LATAM

Required

EDUCATION, BEHAVIOURAL COMPETENCIES AND SKILLS

Bachelor’s degree or equivalent and seven years IT experience, or High School Diploma or equivalent and twelve years of IT experience
Minimum 1 to years’ experience within information security.
Expertise in Cloud security, Perimeter security, secure application design
Expertise in Cloud computing, preferably AWS native technologies
Understanding of container security, cloud network fundamentals, high availability design, microservices, and server less compute
Experience running information security projects
Experience with architectural methodologies and service delivery
Excellent communication skills with ability to explain technical concepts to lay audiences. Experience of with working with function leadership stakeholders
Ability to analyze a variety of data and make appropriate risk-based decisions
Ability to set priorities, develop workflow processes and manage project resources
Strong conceptual and analytical skills - demonstrating outside-the-box problem solving skills in cross-team collaboration
Ability to write and speak in the English language

Desired

Knowledge of Enterprise Architecture methodologies such as TOGAF or the equivalent
Deep knowledge of technology in their domain area
Experience operationalizing services for a DevOps and/or DevSecOps environment
Experience in working in the pharmaceutical industry
Experience with validated systems

What Takeda Can Offer You

At Takeda, you take the lead on building and shaping your own career.

Joining Takeda in Mexico City will give you access to high-end technology, continuous training and a diverse and inclusive network of colleagues who will support your career growth.

It is our priority to provide competitive compensation and a benefit package that bridges your personal life with your professional career. Amongst our benefits are

Competitive Salary + Performance Annual Bonus
Monthly Supermarket and Food Vouchers
Flexible Working Schemes
Comprehensive Healthcare Insurance Plans Life, Medical, Dental & Vision
Additional Time Off
Diversity, Equity, and Inclusion Programs

Locations

MEX - Santa Fe

Worker Type

Employee

Worker Sub-Type

Regular

Time Type

Full time"
Quality Assurance Analyst,Quality Assurance Analyst,GP Strategies Corporation,May,2024,"GP Strategies Corporation is one of the world's leading talent transformation providers. By delivering award-winning learning and development solutions, we help organizations transform through their people and achieve meaningful change. GP Strategies has delivered our innovative consulting, learning services, and talent technology solutions to over 6,000 organizations globally.

From our global experience working across thousands of projects and initiatives over the past 55 years, we've learned that relationships, business, work, innovation, strategy, and transformation are all about people. And, to put it simply, GP Strategies is about our people - an extensive global network of learning experts. Additional information can be found at www.gpstrategies.com.

The Quality Assurance Analyst is the person in charge of planning and supervising quality controls, responsible for organizing and preventing errors to ensure good quality of the final product. He/she must have skills in attention to detail, communication and effective testing. The ability to pay attention to detail is critical in the position. It is necessary to be thorough and meticulous in identifying and understanding the requirements and specifications to be analyzed. In addition, good oral and written communication and collaboration with other team members is required.

Key Activities

Validation and inspection of parts reported with damage.
Damage report and record in database.
Coordinate and manage surplus parts, break bulk.
Remove damaged parts and request inventory adjustment.
Warehouse tours; findings of damaged, out of position, discarded, misplaced parts and relocate them with the Warehouse team.
Returns: capture information in database, reintegrate to inventory, ensure re-labeling of parts due to manufacturing defect.
Discrepancy reports; inspect parts per request.
Capture part numbers, responsible parties, quantities, etc.
Separate and identify pallets with scrap parts.

Qualifications

Bachelor's degree (Bachelor's degree preferred)
Training in software engineering or related fields
Knowledge of office software.
Knowledge of claims database is a plus.
Flow charts and part numbers.
Intermediate to advanced English.
Live in the area of Cuautitlán Izcalli.

With more than 4000 employees in over 30 countries, diversity at GP Strategies is second nature! Beyond our locations, our culture focuses on performance and revolves around respect, fairness, and working collaboratively to achieve our goals. We support our People, no matter who they are or where they are from, because we all have valuable and unique perspectives and approaches. That's how great ideas are born, which enable us to work smarter.

GP Strategies is committed and proud to be an Equal Opportunity Employer. All qualified applicants will receive consideration for employment without regard to race, color, religion, sex (including pregnancy, childbirth and related conditions, sexual orientation, and gender identity), national origin, age, veteran status, disability, or any other federally protected class."
Information Systems Security Compliance Engineer,Information Systems Security Compliance Engineer,Canonical,April,2024,"The Security Compliance Engineer works in the office of the CISO in the Risk & Compliance team to help Canonical to achieve overall security & compliance goals and relevant certifications, as well as compliance with regulatory frameworks and other relevant standards.

The team's role is to ensure that Canonical conducts its business processes in compliance with laws and regulations, internal policies and procedures defined and international standards/best practices. This position is for an individual with the knowledge, drive and personal motivation to help build and grow a strong security & compliance governance framework in a fast-growing tech company, as well as help it achieve/maintain the necessary compliance certifications.

This role can be home or office based. Periodic international travel for training and business meetings is required.

Key responsibilities:

Collaborate with IT operations, Legal, Security, and Engineering teams to define and implement policies and procedures
Help to design and implement controls to strengthen the company's Security Posture
Collaborate with various teams to ensure security standards are met across all projects
Assess vulnerabilities/risks that could affect the integrity, availability, or confidentiality of data, systems, or services of the company and provide mitigation solutions
Conduct regular audits to ensure compliance with internal policies and procedures, relevant security standards best practices, regulations and client requirements to identify gaps and provide remediation solutions
Ensure controls are configured correctly and integrated into the security strategy
Collaborate with internal teams to respond to Security Questionnaires, Contract Compliance and Security & Compliance posture questions from customers
Provide guidance and support to internal stakeholders regarding security & compliance practices
Collaborate with internal teams to gather evidence for external audits
Participate in the creation and or maintenance of the Information Security Management System
Maintain an up-to-date knowledge on Security standards, best practices and trends to ensure ongoing compliance

Required skills and experience:

2+ years of experience within a security and compliance function
Experience developing and maintaining policies, procedures, standards, and guidelines to align with company's strategy and best practices
Experience with security controls implementation, configuration and maintenance
Experience with vulnerability management tooling, remediation, and processes
Experience with coding/scripting in one or more languages (Python, C, C++, Java)
Experience with Linux operating systems (Ubuntu preferred)
Understanding of concepts related to Systems Engineering/DevOps, IaC, IAM, network security, systems security, cryptography
Have a wide understanding of cybersecurity and data protection frameworks such as ISO 27001, NIST, SOC2, PCI-DSS, GDPR, CCPA.
Experience with third party and external audits

Valuable experience:

Bachelor's degree (or equivalent) in Computer Science, Information Systems, or related field
Affinity with Open Source software with regards to compliance
Knowledge of designing and implementing security processes and solutions with topics ranging from architecture, governance, compliance, and operations
Technical or engineering background, including software development, scripting, networking, and cloud architecture

Canonical is a growing international software company that works with the open-source community to deliver Ubuntu, the world's best free software platform. Our services help businesses worldwide reduce costs, improve efficiency and enhance security with Ubuntu.

About Canonical

Canonical is a pioneering tech firm at the forefront of the global move to open source. As the company that publishes Ubuntu, one of the most important open source projects and the platform for AI, IoT and the cloud, we are changing the world on a daily basis. We recruit on a global basis and set a very high standard for people joining the company. We expect excellence - in order to succeed, we need to be the best at what we do. Canonical has been a remote-first company since its inception in 2004. Working here is a step into the future, and will challenge you to think differently, work smarter, learn new skills, and raise your game.

Canonical is an equal opportunity employer

We are proud to foster a workplace free from discrimination. Diversity of experience, perspectives, and background create a better work environment and better products. Whatever your identity, we will give your application fair consideration."
Information Systems Security Compliance Engineer,Information Systems Security Compliance Engineer,Canonical,April,2024,"The Security Compliance Engineer works in the office of the CISO in the Risk & Compliance team to help Canonical to achieve overall security & compliance goals and relevant certifications, as well as compliance with regulatory frameworks and other relevant standards.

The team's role is to ensure that Canonical conducts its business processes in compliance with laws and regulations, internal policies and procedures defined and international standards/best practices. This position is for an individual with the knowledge, drive and personal motivation to help build and grow a strong security & compliance governance framework in a fast-growing tech company, as well as help it achieve/maintain the necessary compliance certifications.

This role can be home or office based. Periodic international travel for training and business meetings is required.

Key responsibilities:

Collaborate with IT operations, Legal, Security, and Engineering teams to define and implement policies and procedures
Help to design and implement controls to strengthen the company's Security Posture
Collaborate with various teams to ensure security standards are met across all projects
Assess vulnerabilities/risks that could affect the integrity, availability, or confidentiality of data, systems, or services of the company and provide mitigation solutions
Conduct regular audits to ensure compliance with internal policies and procedures, relevant security standards best practices, regulations and client requirements to identify gaps and provide remediation solutions
Ensure controls are configured correctly and integrated into the security strategy
Collaborate with internal teams to respond to Security Questionnaires, Contract Compliance and Security & Compliance posture questions from customers
Provide guidance and support to internal stakeholders regarding security & compliance practices
Collaborate with internal teams to gather evidence for external audits
Participate in the creation and or maintenance of the Information Security Management System
Maintain an up-to-date knowledge on Security standards, best practices and trends to ensure ongoing compliance

Required skills and experience:

2+ years of experience within a security and compliance function
Experience developing and maintaining policies, procedures, standards, and guidelines to align with company's strategy and best practices
Experience with security controls implementation, configuration and maintenance
Experience with vulnerability management tooling, remediation, and processes
Experience with coding/scripting in one or more languages (Python, C, C++, Java)
Experience with Linux operating systems (Ubuntu preferred)
Understanding of concepts related to Systems Engineering/DevOps, IaC, IAM, network security, systems security, cryptography
Have a wide understanding of cybersecurity and data protection frameworks such as ISO 27001, NIST, SOC2, PCI-DSS, GDPR, CCPA.
Experience with third party and external audits

Valuable experience:

Bachelor's degree (or equivalent) in Computer Science, Information Systems, or related field
Affinity with Open Source software with regards to compliance
Knowledge of designing and implementing security processes and solutions with topics ranging from architecture, governance, compliance, and operations
Technical or engineering background, including software development, scripting, networking, and cloud architecture

Canonical is a growing international software company that works with the open-source community to deliver Ubuntu, the world's best free software platform. Our services help businesses worldwide reduce costs, improve efficiency and enhance security with Ubuntu.

About Canonical

Canonical is a pioneering tech firm at the forefront of the global move to open source. As the company that publishes Ubuntu, one of the most important open source projects and the platform for AI, IoT and the cloud, we are changing the world on a daily basis. We recruit on a global basis and set a very high standard for people joining the company. We expect excellence - in order to succeed, we need to be the best at what we do. Canonical has been a remote-first company since its inception in 2004. Working here is a step into the future, and will challenge you to think differently, work smarter, learn new skills, and raise your game.

Canonical is an equal opportunity employer

We are proud to foster a workplace free from discrimination. Diversity of experience, perspectives, and background create a better work environment and better products. Whatever your identity, we will give your application fair consideration."
Information Systems Security Compliance Engineer,Information Systems Security Compliance Engineer,Canonical,April,2024,"The Security Compliance Engineer works in the office of the CISO in the Risk & Compliance team to help Canonical to achieve overall security & compliance goals and relevant certifications, as well as compliance with regulatory frameworks and other relevant standards.

The team's role is to ensure that Canonical conducts its business processes in compliance with laws and regulations, internal policies and procedures defined and international standards/best practices. This position is for an individual with the knowledge, drive and personal motivation to help build and grow a strong security & compliance governance framework in a fast-growing tech company, as well as help it achieve/maintain the necessary compliance certifications.

This role can be home or office based. Periodic international travel for training and business meetings is required.

Key responsibilities:

Collaborate with IT operations, Legal, Security, and Engineering teams to define and implement policies and procedures
Help to design and implement controls to strengthen the company's Security Posture
Collaborate with various teams to ensure security standards are met across all projects
Assess vulnerabilities/risks that could affect the integrity, availability, or confidentiality of data, systems, or services of the company and provide mitigation solutions
Conduct regular audits to ensure compliance with internal policies and procedures, relevant security standards best practices, regulations and client requirements to identify gaps and provide remediation solutions
Ensure controls are configured correctly and integrated into the security strategy
Collaborate with internal teams to respond to Security Questionnaires, Contract Compliance and Security & Compliance posture questions from customers
Provide guidance and support to internal stakeholders regarding security & compliance practices
Collaborate with internal teams to gather evidence for external audits
Participate in the creation and or maintenance of the Information Security Management System
Maintain an up-to-date knowledge on Security standards, best practices and trends to ensure ongoing compliance

Required skills and experience:

2+ years of experience within a security and compliance function
Experience developing and maintaining policies, procedures, standards, and guidelines to align with company's strategy and best practices
Experience with security controls implementation, configuration and maintenance
Experience with vulnerability management tooling, remediation, and processes
Experience with coding/scripting in one or more languages (Python, C, C++, Java)
Experience with Linux operating systems (Ubuntu preferred)
Understanding of concepts related to Systems Engineering/DevOps, IaC, IAM, network security, systems security, cryptography
Have a wide understanding of cybersecurity and data protection frameworks such as ISO 27001, NIST, SOC2, PCI-DSS, GDPR, CCPA.
Experience with third party and external audits

Valuable experience:

Bachelor's degree (or equivalent) in Computer Science, Information Systems, or related field
Affinity with Open Source software with regards to compliance
Knowledge of designing and implementing security processes and solutions with topics ranging from architecture, governance, compliance, and operations
Technical or engineering background, including software development, scripting, networking, and cloud architecture

Canonical is a growing international software company that works with the open-source community to deliver Ubuntu, the world's best free software platform. Our services help businesses worldwide reduce costs, improve efficiency and enhance security with Ubuntu.

About Canonical

Canonical is a pioneering tech firm at the forefront of the global move to open source. As the company that publishes Ubuntu, one of the most important open source projects and the platform for AI, IoT and the cloud, we are changing the world on a daily basis. We recruit on a global basis and set a very high standard for people joining the company. We expect excellence - in order to succeed, we need to be the best at what we do. Canonical has been a remote-first company since its inception in 2004. Working here is a step into the future, and will challenge you to think differently, work smarter, learn new skills, and raise your game.

Canonical is an equal opportunity employer

We are proud to foster a workplace free from discrimination. Diversity of experience, perspectives, and background create a better work environment and better products. Whatever your identity, we will give your application fair consideration."
