Position,Company_Name,Location,Post_Month,Post_Year,Details
"Manager, Program Management - FBA Supply Chain, Marketplace - Fulfilment by","Manager, Program Management - FBA Supply Chain, Marketplace - Fulfilment by",myGwork - LGBTQ+ Business Community,May,2024,"This inclusive employer is a member of myGwork – the largest global platform for the LGBTQ+ business community.

Description

Amazon Mexico currently seeks an innovative, hands-on, analytical and results-oriented Senior Program Manager to lead part of the FBA Supply Chain processes in Mexico.

Fulfiment by Amazon (FBA) offers logistic services to third-party selling partners on our marketplace, in Mexico and beyond. We ship products on behalf of our partners, and handle the supply chain when our customers need to return the product they bought.

Processes are either existing or to be built.

A successful Program Manager must be able to work independently, understand rapidly the key pain points of the processes, and influence internal/external partners at all levels of the organization. This role will particularly suits someone with strong analytical abilities, relationship building skills and superb project management capabilities.

Key job responsibilities

The Supply Chain manager ensures our processes provide Sellers what it takes to be successful. Fast, efficient, and cheap processes across the value chain. The role coordinates a team of L5/L6 PM to ensure the long term vision is clear and operationalized daily. The role interacts frequently with Ops, Products, Finance, and other FBA teams WW.

A day in the life

Inclusive team culture

At Amazon we embrace our differences and we are committed to furthering our culture of inclusion. We host annual and ongoing learning experiences. Amazon's culture of inclusion is reinforced within our 14 Leadership Principles, which remind team members to seek diverse perspectives, learn and be curious, and earn trust

Work Life Balance

We believe striking the right balance between your personal and professional life is critical to life-long happiness and fulfillment. We offer flexibility in working hours and encourage you to find your own balance between your work and personal lives.

Mentorship& Career Growth

Our team is dedicated to supporting new members. We have a broad mix of experience levels and tenures, and we're building an environment that celebrates knowledge sharing and mentorship. We care about your career growth and strive to assign projects based on what will help each team member develop into a better-rounded professional.

We are open to hiring candidates to work out of one of the following locations:

Mexico City, DIF, MEX

Basic Qualifications

3+ years of team management experience
Bachelor's degree in supply chain, business, engineering, finance or related technical or quantitative field
7+ years of program or project management experience
5+ years of working cross functionally with tech and non-tech teams experience
Knowledge of Microsoft Excel (macros, pivots, lookups) at an advanced level

Preferred Qualifications

Experience defining program requirements and using data and metrics to determine improvements
Knowledge of SQL"
"Manager, Program Management - FBA Supply Chain, Marketplace - Fulfilment by Amazon","Manager, Program Management - FBA Supply Chain, Marketplace - Fulfilment by Amazon",Amazon,May,2024,"Description

Amazon Mexico currently seeks an innovative, hands-on, analytical and results-oriented Senior Program Manager to lead part of the FBA Supply Chain processes in Mexico.

Fulfiment by Amazon (FBA) offers logistic services to third-party selling partners on our marketplace, in Mexico and beyond. We ship products on behalf of our partners, and handle the supply chain when our customers need to return the product they bought.

Processes are either existing or to be built.

A successful Program Manager must be able to work independently, understand rapidly the key pain points of the processes, and influence internal/external partners at all levels of the organization. This role will particularly suits someone with strong analytical abilities, relationship building skills and superb project management capabilities.

Key job responsibilities

The Supply Chain manager ensures our processes provide Sellers what it takes to be successful. Fast, efficient, and cheap processes across the value chain. The role coordinates a team of L5/L6 PM to ensure the long term vision is clear and operationalized daily. The role interacts frequently with Ops, Products, Finance, and other FBA teams WW.

A day in the life

Inclusive team culture

At Amazon we embrace our differences and we are committed to furthering our culture of inclusion. We host annual and ongoing learning experiences. Amazon’s culture of inclusion is reinforced within our 14 Leadership Principles, which remind team members to seek diverse perspectives, learn and be curious, and earn trust

Work Life Balance

We believe striking the right balance between your personal and professional life is critical to life-long happiness and fulfillment. We offer flexibility in working hours and encourage you to find your own balance between your work and personal lives.

Mentorship& Career Growth

Our team is dedicated to supporting new members. We have a broad mix of experience levels and tenures, and we’re building an environment that celebrates knowledge sharing and mentorship. We care about your career growth and strive to assign projects based on what will help each team member develop into a better-rounded professional.

We are open to hiring candidates to work out of one of the following locations:

Mexico City, DIF, MEX

Basic Qualifications

3+ years of team management experience
Bachelor's degree in supply chain, business, engineering, finance or related technical or quantitative field
7+ years of program or project management experience
5+ years of working cross functionally with tech and non-tech teams experience
Knowledge of Microsoft Excel (macros, pivots, lookups) at an advanced level

Preferred Qualifications

Experience defining program requirements and using data and metrics to determine improvements
Knowledge of SQL


Company - Servicios Comerciales Amazon Mexico S. de R.L. de C.V.

Job ID: A2649557"
"Sr Program Manager Speed MX, External Fulfillment Latam","Sr Program Manager Speed MX, External Fulfillment Latam",myGwork - LGBTQ+ Business Community,May,2024,"This inclusive employer is a member of myGwork – the largest global platform for the LGBTQ+ business community.

Description

At Amazon, we're working to be the most Customer-centric company on earth, so we are constantly looking for ways to improve delivery experience. Our goal is to exceed the expectations of all our customers by ensuring that their orders, no matter how large or small, are delivered where and when they need them, as quickly, accurately, and cost effectively as possible. To meet this goal, Amazon is continually striving to innovate and provide best in class service levels through multiple fulfillment channels.

A successful candidate must be passionate about understanding customer pain points, has an unending desire to uncover root causes of any defect, works independently, is comfortable with ambiguity, and able to influence internal/external partners at all levels of the organization. This role will particularly suit someone with strong skills in program management, analytics, queries, communication both written and verbal, relationship building and Customer Obsession.

Key job responsibilities

This role is responsible for the full picture of External Fulfillment Speed in MX, from day-to-day dive deeps to understand trends to driving strategic direction of Speed investments

Develop, implement, and manage KPI reporting for a portfolio of programs, providing visibility of milestones and performance across all projects and using this data to drive/influence business decisions

Secure resources, scope efforts, set priorities and milestones and drive delivery of main projects

Influence processes design and development

Benchmark globally to share best practices and improve outcomes for Amazon customers

We are open to hiring candidates to work out of one of the following locations:

Mexico City, DIF, MEX

Basic Qualifications

Bachelor's degree
Experience using data and metrics to determine and drive improvements
7+ years of program or project management experience
5+ years of working cross functionally with tech and non-tech teams experience
Excel at an advanced level and SQL

Preferred Qualifications

Experience implementing repeatable processes and driving automation or standardization
Experience in complex problem solving, and working in a tight schedule environment"
PMO Planning Specialist,PMO Planning Specialist,Stellantis,March,2024,"Stellantis is transforming into a customer centric sustainable mobility company and is looking for motivated and passionate individuals to join our team. The Project Management Office (PMO) is a critical function of the Cross Carline & Project Engineering Team and is responsible for oversight of common process and methods used to achieve technical, quality, timing and cost targets.

Responsibilities

The PMO Planning Specialist is responsible for supporting the Platform and Project Planning Manager in the achievement of project timing, labor and investment objectives of the vehicle. Responsibilities may include, but not limited to:

Coordinate the general and detailed (by phase) scheduling of the project /program to ensure timing consistency in execution
Create / Manage Bulletins and Bulletin responses
Collaborate with cross-functional teams to create for governance decks of product action requests
Facilitate PMT and Program Review
Manage vehicle build plan and delivery to support vehicle validation requirements
Manage the commercial launch plan (volumes and dates) with the Brand(s), the Plant(s) and the Purchasing Department
Escalate issues and roadblocks promptly while driving issue resolution.
Lead meetings, collect and monitor inputs for Engineering Research & Development spending and develop/monitor engineering resources per approved spending plan.

The Planning Specialist’s primary interface is with the Vehicle Project, Platform & Modules Teams Planning (QCTP) Manager and the Chief Project Engineer (CVE)

Temporary position (18 months)

Basic Qualifications

Minimum of a Bachelor's degree in Engineering, Finance or Business from an ABET accredited university. Other degree/educational credentials, in combination with relevant experience, may be considered.
Minimum of 5 years automotive industry experience at an OEM or large tier 1 in any of the following areas: Product development engineering, program management, finance, accounting or quality
Must be a highly motivated, detail oriented, and a self-directed process thinker
Strong interpersonal and leadership skills
Strong written and presentation skills are a must
Advanced to expert skill level in using Excel and PowerPoint.
Ability to interface with all levels of management

Preferred Qualifications

Full Program Life-cycle Experience
Stellantis PDP understanding
Launch Experience a plus
Manufacturing process fundamentals understanding
Ability to quickly learn use of proprietary Stellantis software
Advanced skills required in manipulating, interpreting, comparing, and overall analysis of large data sets/financials

Temporary Position (18 months) At Stellantis, we assess candidates based on qualifications, merit and business needs. We welcome applications from people of all gender identities, age, ethnicity, nationality, religion, sexual orientation and disability. Diverse teams will allow us to better meet the evolving needs of our customers and care for our future."
Manager IT Program Management,Nestle IT,"Miguel Hidalgo, Mexico City, Mexico",June,2024,"(MANAGER IT PROGRAM MANAGMENT)

We are looking for a MANAGER IT PROGRAM MANAGMENT to be part of our NUSA team.

Position Snapshot

Location: Mexico City
NUSA
Type of work: Hybrid
Work Language: Fluent Business English

The role

A senior agile servant leader and trainer with experience helping large companies transition to agile ways of working and achieving business value through agility.

What You’ll Do

Coaching existing agile teams and “teams of teams”, including building a coaching plan prioritized changes likely to have the biggest impact on business results
Train and coach executive leadership, program, and scrum team members clarifying roles and responsibilities and offering motivation and support, as necessary.
Guide teams into the Agile methodology, providing employees with feedback and means of improvement, catalyzing organizational growth, and answering questions
Provide hands-on support and collaboration across the organization leading teams toward further understanding and adoption of Agile as well as overall company growth and improvement
Implement outcome-oriented metrics to support continuous improvement

We offer you

We offer more than just a job. We put people first and inspire you to become the best version of yourself.

Great benefits including competitive salary and a comprehensive social benefits package. We have one of the most competitive pension plans on the market, as well as flexible remuneration with tax advantages: health insurance, restaurant card, mobility plan, etc.
Personal and professional growth through ongoing training and constant career opportunities reflecting our conviction that people are our most important asset.
Hybrid working environment with flexible working scheme. Our state-of-the-art campus is dog friendly and equipped with a medical center, canteen and areas to co-create network and chill!
Recreation activities such as yoga, Zumba, etc. and a wide range of volunteering activities.

Minimum qualifications:

Comfort communicating to leadership
Articulation of plan to scale Agile transformation
Listening to team’s concern and implementing ideas on improvement
Capable of dealing with and managing conflict
Able to work effectively in an environment with many competing and high priority demands
Agile Coach certification required (Scrum Alliance)

Bonus Points If You:

Experience with Agile Lifecyle Tools such as Azure Devops, JIRA, Version One, Rally
Scaled Agile Framework (SAFe) SPC certification
Scrum@Scale certification
Launching new Agile Release Trains (ARTs)
Leading multiple 2-day training sessions for scaled agile implementations (e.g., Scrum@Scale, SAFe for Teams, SAFe Scrum Master, and SAFe Product Owner training)

How we will proceed:

You send us your CV → We contact relevant applicants → Interviews → Feedback → Job Offer communication to the Finalist → First working day

About The IT Hub (Final Paragraph Under Review)

We are a team of IT professionals from many countries and diverse backgrounds, each with unique missions and challenges in the biggest health, nutrition and wellness company of the world. We innovate every day through forward-looking technologies to create opportunities for Nestlé’s digital challenges with our consumers, customers and at the workplace. We collaborate with our business partners around the world to deliver standardized, integrated technology products and services to create tangible business value.

About Nestlé

We are Nestlé, the largest food and beverage company. We are 308,000 employees strong driven by the purpose of enhancing the quality of life and contributing to a healthier future. Our values are rooted in respect: respect for ourselves, respect for others, respect for diversity and respect for our future. With more than CHF 91.4 billion sales in 2018, we have an expansive presence with 413 factories in more than 85 countries. Want to learn more? Visit us at www.nestle.com.

We encourage the diversity of applicants across gender, age, ethnicity, nationality, sexual orientation, social background, religion or belief and disability.

Step outside your comfort zone; share your ideas, way of thinking and working to make a difference to the world, every single day. You own a piece of the action – make it count.

Join IT Hub Nestlé #beaforceforgood"
Program Manager 4 (R),Program Manager 4 (R),Sanmina,May,2024,"Job Description

Program Manager 4

Program Manager 4

Licenciatura in Industrial Engineering, Administration, International Business or similar.
English 90%
Competence in Microsoft Office, Google tools (Sheets. Presentation).
Minimum 8 years of experience in customer service / program management with technical knowledge in repairs.
Excellent communication skills, ability to manage a group of direct reporting employees.
Excellent negotiation skills, ability to speak and negotiate with clients.
Understand the shipping process / methods and incoterms.
Manage: OTD, PPV, ECO, E & O, quote process, stock records, yields, customer request and reports.
Flexibility (able to take calls / meeting outside standard working time)
Capable of managing the client's visit / agenda, visits to the plant

Understand all aspects required to launch a new program or order

It serves as a site link between the company and the customer to ensure that the customer's needs are met."
Sr. Project Manager M&A Integrations & Separations,Sr. Project Manager M&A Integrations & Separations,Thomson Reuters,May,2024,"Are you ready to lead the transformation? We are seeking a highly motivated Sr. Project Manager for mergers, acquisitions and divestitures (M&A) to join the organization, manage the scope, time, and finances of medium-sized projects while working with leadership and business partners to achieve business objectives in the delivery of projects.

About The Role

In this opportunity as Sr. Project Manager M&A you will:

Deliver projects within the constraints of scope, time and cost to agreed levels of quality, within the organization’s project management framework.
Define, document and manage medium to small -scale projects with minimal supervision, working with multiple teams that may have differing priorities and working/cultural practices.
Actively participate in all phases of the project or specific phases of larger projects. Identify, assess and manage risks to the success of the project
Effectively manage project team conflicts, build collaborative partnerships with stakeholders, and commitment to make decisions.
Estimate costs, timelines and resource requirements for the successful completion of each project to agreed scope and constraints.
Prepare and maintain project plans and tracks performance against the plan.
Implement effective communication plan and operating rhythm, including provision of regular and accurate reports.
Monitor costs, timescales and resources used, and takes action where these deviate from agreed plan. Ensure that deliverables are implemented within these criteria.
Manage change control gaining agreement for revisions from project stakeholders.
Provide effective project management leadership to the project team ensuring members are collaborating.


About You

You’re a fit for the role of Sr. Project Manager M&A if your background includes:

7+ years of Project Management experience
Planning and Organization: Ability to create detailed project plans, set milestones, and coordinate tasks effectively.
Risk Management: Identifying potential risks associated with the M&A process and developing strategies to mitigate them.
Schedule Management: Ensuring that the M&A project stays on schedule and meets deadlines.
Stakeholder Communication: Communicating effectively with various stakeholders, including executives, employees, and external partners.
Business Acumen: Understanding the broader business context and how the M&A project aligns with the overall strategy of the organizations involved.
Analytical Skills: Analyzing data and making informed decisions that align with the strategic goals of the merged entity.
Project Management & Office Tools: Proficient knowledge of Microsoft tools such as Teams, PowerPoint, Excel, Word and familiarity with project management software and tools to facilitate efficient collaboration and communication.
Financial Analysis: Analyzing financial data related to the M&A project, including valuations, cost structures, and financial projections.
Budget Management: Managing the budget allocated for the M&A project and ensuring cost-effectiveness.
Global Collaboration: Ability and flexibility to collaborate with global teams in multiple time zones.
Travel: up to 10%
Location: Mexico, India


What’s In It For You?

You will join our inclusive culture of world-class talent, where we are committed to your personal and professional growth through:
Hybrid Work Model: We’ve adopted a flexible hybrid working environment for our office-based roles while delivering a seamless experience that is digitally and physically connected.
Culture: Globally recognized and award-winning reputation for equality, diversity and inclusion, flexibility, work-life balance, and more.
Wellbeing: Comprehensive benefit plans; flexible and supportive benefits for work-life balance: two company-wide Mental Health Days Off; work from another location for up to a total of 8 weeks in a year, 4 of those weeks can be out of the country and the remaining in the country, Headspace app subscription; retirement, savings and employee incentive programs; resources for mental, physical, and financial wellbeing.
Learning & Development: LinkedIn Learning access; internal Talent Marketplace with opportunities to work on projects cross-company; Ten Thousand Coffees Thomson Reuters café networking.
Social Impact: Nine employee-driven Business Resource Groups; two paid volunteer days annually; Environmental, Social and Governance (ESG) initiatives for local and global impact.
Purpose Driven Work: We have a superpower that we’ve never talked about with as much pride as we should – we are one of the only companies on the planet that helps its customers pursue justice, truth and transparency. Together, with the professionals and institutions we serve, we help uphold the rule of law, turn the wheels of commerce, catch bad actors, report the facts, and provide trusted, unbiased information to people all over the world.


As a global business we rely on diversity of culture and thought to deliver on our goals. To ensure we can do that, we seek talented, qualified employees in our operations around the world regardless of race, color, sex/gender, including pregnancy, gender identity and expression, national origin, religion, sexual orientation, disability, age, marital status, citizen status, veteran status, or any other protected classification under country or local law. We are proud to be an Equal Employment Opportunity Employer providing a drug-free workplace.

Do you want to be part of a team helping re-invent the way knowledge professionals work? How about a team that works every day to create a more transparent, just and inclusive future? At Thomson Reuters, we’ve been doing just that for almost 160 years. Our industry-leading products and services include highly specialized information-enabled software and tools for legal, tax, accounting and compliance professionals combined with the world’s most global news services – Reuters. We help these professionals do their jobs better, creating more time for them to focus on the things that matter most: advising, advocating, negotiating, governing and informing.

We are powered by the talents of 26,000 employees across more than 70 countries, where everyone has a chance to contribute and grow professionally in flexible work environments that celebrate diversity and inclusion. At a time when objectivity, accuracy, fairness and transparency are under attack, we consider it our duty to pursue them. Sound exciting? Join us and help shape the industries that move society forward.

Accessibility

As a global business, we rely on diversity of culture and thought to deliver on our goals. To ensure we can do that, we seek talented, qualified employees in all our operations around the world regardless of race, color, sex/gender, including pregnancy, gender identity and expression, national origin, religion, sexual orientation, disability, age, marital status, citizen status, veteran status, or any other protected classification under applicable law. Thomson Reuters is proud to be an Equal Employment Opportunity/Affirmative Action Employer providing a drug-free workplace.

We also make reasonable accommodations for qualified individuals with disabilities and for sincerely held religious beliefs in accordance with applicable law.

Protect yourself from fraudulent job postings click here to know more.

More information about Thomson Reuters can be found on https://thomsonreuters.com."
