Position,Company_Name,Location,Post_Month,Post_Year,Details
1300 Pre-series Analyst Medium,1300 Pre-series Analyst Medium,Alten México,May,2024,"ALTEN Mexico is a leading engineering and technology company that provides innovative solutions to various industries, including Automotive, Energy, Aeronautics, Banking & Insurance, Telecom & Multimedia, and Rail. With a strong global presence and over 30 years of industry experience, ALTEN Group employs over 46,000 engineers worldwide.

We are currently seeking a highly motivated Pre-series Analyst Medium to join our team at ALTEN Mexico. As a Pre-series Analyst Medium, you will play a key role in analyzing and evaluating pre-series data and supporting the development and launch of new products. Your work will contribute to ensuring product quality, reliability, and successful series production.

General Activities:

The activities for the Pre-series Analyst are but not limited to the following:

Meet vehicle launch timelines & deliverables and ensure the transition to quality volume production
Responsible for part and assembly compliance and geometrical analysis
Ensure convergence of industrial indicators, issue containment, rework timing and perimeter within the assembly plant. *Manage engineering robustness and launch issue solving before handover to manufacturing for volume production
Accountable for safety conditions and ensureings working quality for the launch team
Leads Technical review, status for each milestone, maturity plan tracking and handover to manufacturing
Ensure high level of communication to the team and progress reporting to Management
Ensure the progress pace of all launch activities,
Manage part conformity, design validation and change requests system for launch vehicle issues
Responsible for escalation process, in contact with all partners, suppliers, subcontractors for timely resolution of issues

Requirements

Bachelor of Science in Engineering education.
Manufacturing process & launch experience is preferred.
Mastery of geometry assessments (technical documents and processes).
Management of scheduling, organization, and internal processes for the launching phase activities.
Knowledge of Manufacturing processes and trades (stamping, welding, painting and assembly)
Knowledge of the BCI product design fundamentals
Knowledge of APQP/PPAP and Change Management processes.
Self-motivator with a strong passion for automobiles and appreciation for quality.
Basic understanding of statistics and root cause problem solving.
Excellent communication, organizational and leadership skills a must!
Proficient in Microsoft Office and Google Apps is a must (Excel, power BI)
High level of proficiency in English (speaking, reading, writing)

Benefits

Benefits higher than those required by law
Professional growth and development
Indeterminate Contract
Hybrid scheme"
Analista de Filantropía,Analista de Filantropía,Universidad de Monterrey,May,2024,"La Universidad de Monterrey, basada en su inspiración católica, valores y excelencia académica, forma integralmente a la persona para que contribuya a la construcción de una sociedad sostenible, trascienda en el servicio a los demás y alcance su plenitud.

Tu talento puede inspirar a toda una comunidad, estamos buscando:

Analista de Estrategia

Objetivo Del Puesto

Investigación, medición y evaluación de proyectos estratégicos de la Vicerrectoría de Desarrollo, para asegurar el cumplimiento de su estrategia.

Principales Responsabilidades

Apoyar en la investigación de oportunidades filantrópicas y de la comunidad de egresados que tenga la universidad.
Apoyar en el desarrollo de proyectos alineados a la Planeación Estratégica del área.
Dar soporte en el desarrollo de indicadores (KPI´s) y objetivos que ayude a medir el impacto de los proyectos.
Investigar las mejores prácticas en materia de planeación y estrategia.
Elaboración de reportes y presentaciones

Estudios Académicos

Administración de Proyectos, Relaciones Internacionales, Nuevos Negocios Gestión de Proyectos (Titulado).

Horario

Lunes a viernes de 8:00 am a 5:30 pm

Ofrecemos

Prestaciones de ley los primeros 3 meses y tarjeta de restaurante (Subsidiada al 80%).
Al obtener la planta (posterior a los 3 primeros meses) se agregan prestaciones superiores a las de Ley: Fondo de Ahorro, Vales de despensa, Aguinaldo de 45 días, Seguro de Gastos Médicos Mayores para el colaborador."
Analista de IMSS e Infonavit (TEMPORAL),Analista de IMSS e Infonavit (TEMPORAL),Universidad de Monterrey,May,2024,"En La Universidad De Monterrey, Fortalecemos Nuestra Misión Educativa Con Valores Católicos y Un Compromiso Inquebrantable Con La Excelencia Académica. Formamos Líderes Capaces De Impactar Positivamente En Una Sociedad Sostenible, Con Un Espíritu De Servicio Que Trasciende. En Este Contexto, Buscamos Un Profesional Excepcional Para Sumarse a Nuestro Equipo Como

Analista de IMSS e Infonavit (TEMPORAL)

Objetivo del Puesto: Administrar y controlar créditos INFONAVIT, conciliación de bases de datos, apoyo para pago oportuno IMSS, INFONAVIT e ISR, atender requerimientos externos y asesoría a colaboradores con temas referentes a lo anterior.

Principales Responsabilidades

Administración y control de créditos INFONAVIT
Conciliaciones de movimientos IMSS, INFONAVIT e ISR
Atención, control y aclaración de Requerimientos IMSS, SAT e INFONAVIT
Asesoramiento a Jefes y Gerentes de área.
Conciliación de las bases de datos para pagos mensuales y bimestrales
Entrega de documentación a colaboradores referente a IMSS, INFONAVIT e ISR
Atención y Asesoría a Colaboradores de UDEM en temas de IMSS e Infonavit

Requisitos Académicos

Licenciatura en Contabilidad, Finanzas, Administración o campo afín.

Experiencia Requerida

Experiencia en Administración de Empresas o afín (3 años).

Ofrecemos

Prestaciones de Ley.
Tarjeta de restaurant subsidiada (80%).
Proyecto Temporal hasta Diciembre 2024."
Crowdsourcing Efficiency Analyst,Crowdsourcing Efficiency Analyst,Walmart de México y Centroamérica,May,2024,"Crowdsourcing Efficiency Analyst

Objetivo principal:
Coordina la eficiencia en las Operaciones de Crowdsourcing , encargado de supervisar y optimizar las operaciones de nuestraflota de OnDemand, garantiza la eficiencia operativa para cumplir con los estándares de entregas en tiempo y maximizar la disponibilidad mediante la gestión de picos de demanda, la coordinación de supply y la implementación de estrategias para prevenir riesgos operacionales.

¿Qué harás?
• Supervisar y coordinar la fuerza laboral de trabajadores independientes, para segurar que se disponga del personal adecuado para cubrir la demanda, utilizando herramientas y plataformas de gestión para asignar tareas y monitorear el desempeño.
• Realizar ajustes vs el seguimiento de KPIs y evaluar el desempeño para proporcionar retroalimentación constructiva a los responsables de la operación.
• Coordinar las llegadas de shoppers para optimizar el servicio y asegurar las entregas en tiempo trabajando estrechamente con el equipo de capacidades y comunicación.
• Monitorear y analizar indicadores clave de rendimiento para identificar áreas de mejora y tomar medidas correctivas según sea necesario.
• Planificar y gestionar las fluctuaciones en la demanda para asegurar que la operación pueda responder eficazmente durante los períodos de alta demanda, desarrollando estrategias de flexibilidad laboral y uso eficiente de recursos.
• Identificar y mitigar riesgos en la operación diaria, para minimizar interrupciones y asegurar la continuidad del servicio, implementando sistemas de monitoreo y planes de contingencia.
• Ejecutar los controles de calidad en los procesos operativos para garantizar la consistencia y la calidad en la ejecución de tareas.
• Identificar tendencias, patrones y oportunidades de mejora utilizando herramientas de análisis de datos para monitorear el desempeño del equipo y tomar decisiones basadas en datos para mejorar la productividad.

¿A quién buscamos?
Experiencia de 6 meses a 1 año en modelos de negocio de startup de deliverys o procesos de entregas a domicilio.
Experiencia en gestionar y ejecutar proyectos de eficiencias operativas y calidad de servicio.
Experiencia y conocimientos de procesos operativos.
Trabajo bajo KPI´s, metricas o indicadores.
Manejo de Excel avanzado.
Manejo y analisis de datos.
Inglés conversacional nivel intermedio.
Habilidades en analisis, estrategia, comunicación, trabajo en equipo, innovación.

En Walmart de México y Centroamérica nos comprometemos con la Diversidad, Equidad e Inclusión, buscamos incorporar al mejor talento basándonos en competencias, habilidades y potencial; no discriminamos por ningún motivo, durante el proceso de atracción y selección no solicitaremos información personal, fotografías o análisis clínicos de ningún tipo, incluyendo VIH o pruebas de embarazo. No discriminamos por género, edad, origen étnico, apariencia física, estado civil, estado de salud, situación socioeconómica, discapacidad, orientación sexual, identidad o expresión de género u otros; por ello consideramos que tus datos personales no son relevantes durante el proceso de entrevista ni para la selección final.
En Walmart estamos trabajando por contar con mayor accesibilidad, en caso de que necesites algún ajuste razonable por favor compártelo con el equipo de Reclutamiento."
Analista IMSS,Analista IMSS,Tata Consultancy Services,May,2024,"Objetivo del puesto:
Responsable del proceso operativo, cálculo, de control y de administración de previsiones sociales, con el fin de garantizar la determinación de cuotas obrero – patronales y pago oportuno.

Trabajo PRESENCIAL, CDMX Col. Narvarte
INGLÉS AVANZADO- INDISPENSABLE

Responsable de:
Actualización sistema de seguridad social (SUA-ITSE): Contrataciones
Actualización del sistema de seguridad social (SUA-ITSE): Separaciones
Reconciliación de datos maestros de empleados: RFC, CURP, NSS, Salario, Fecha de Ingreso, Fecha de Salida
Conciliación informe de incapacidades seguridad social (escritorio virtual) vs Informe RRHH
Actualización sistema de seguridad social: Modificaciones salariales
Cálculo y presentación de variables ""salario base de cotización""
Confrontas nómina, EMA/EBA vs SUA
Descarga de CFDI´s IMSS e Infonavit
Elaborar plantillas de contabilidad
Mantener actualizado el vaciado de los pagos de la seguridad social
Seguimiento de créditos fiscales: IMSS, Infonavit & Fonacot
Aclaración de Requerimientos IMSS & Infonavit por diferencias en incapacidades,
Seguimiento a las Opiniones de Cumplimiento IMSS & Infonavit
Calcular diferencias por créditos fiscales
Tramites en Subdelegación IMSS, Infonavit & Fonacot
Elaborar plantillas de contabilidad de los pagos adicionales por requerimientos y/o créditos fiscales
Actualización y presentación de la Prima de Riesgo de la Compañía
Manejo de Dictamen de Seguridad Social"
Analista Modelador - (AMD0201-0001),Analista Modelador - (AMD0201-0001),Rules Cube,March,2024,"Analista Modelador

En la búsqueda de un Analista Moderador proactivo y hábil para integrarse a nuestro equipo en la Ciudad de México, enfocaremos nuestra atención en aquellos individuos que demuestren experiencia en la realización de Modelado de Información y Análisis de Datos mediante el uso de herramientas especializadas en el Modelado. Este rol es fundamental para la coordinación de equipos interfuncionales y para llevar a cabo proyectos de manera eficiente y ágil. Si tienes un historial comprobado en este campo y estás listo para asumir el desafío de impulsar proyectos hacia su conclusión con éxito, ¡nos encantaría conocerte!

Perfil Esperado

Experiencia mínima de 4 años en el análisis de bases de datos con millones de registros, ofreciendo soluciones en modelos relacionales y dimensionales
Conocimientos sólidos en Modelado de Datos, con experiencia en el uso de ERWIN u herramientas similares
Experiencia previa en entornos de Data Warehouse y bases de datos con modelos analíticos multidimensionales
De la siguiente carrera: Ingeniería de Sistemas Computacionales o a fin.
Experiencia avanzada en el uso de Microsoft SQL Server (MS SQL) para la gestión y manipulación de bases de datos (deseable)
Competencia en el uso de SAS para análisis de datos y generación de informes (deseable)
Experiencia en la administración y gestión de al menos un Gestor de Bases de Datos (BD), demostrando habilidades sólidas en su configuración y mantenimiento (deseable)

Requisitos Obligatorios para ser Considerado

Realización de Modelado de Información y Análisis de Datos utilizando herramientas especializadas en el Modelado
Dominio en el uso de ERWIN para el diseño y gestión de modelos de datos
Nivel de inglés: Técnico

Lo Que Ofrecemos

Empleo en nómina desde el primer día
Seguro de salud para tu tranquilidad y bienestar
Participación en proyectos desafiantes que promueven el crecimiento profesional e innovación
Rango salarial competitivo: MXN 48,000 - MXN 53,000

Si eres un Analista Modelador experimentado buscando tener un impacto significativo y crecer profesionalmente en un entorno dinámico, te invitamos a aplicar y unirte a nuestro equipo.

Powered by JazzHR

dYJbiUROGV"
Junior Renewals Desk Analyst,Junior Renewals Desk Analyst,GlobalLogic Latinoamérica,May,2024,"JR Renewals Desk Analyst
GlobalLogic Mexico (Hybrid)
GlobalLogic family
Expand your skills by collaborating with a diverse team of highly talented people in an open, laidback environment and ¡Be part of the forefront of digital transformation!
We offer an opportunity to participate in creating market-defining products using the latest technologies with clients across all industries and sectors. GlobalLogic prioritizes work-life balance, which is why we offer flexible opportunities and options.
About the role:
We are looking for aJR Renewals Desk Analyst with strong analytical skills and logical thought processes with the ability to identify and resolve complex issues/problems. Ideal candidate is hands-on, proven ability to function well in a team environment and must be proactive, self-directed, self-motivated, detailed, quick learner, and organized.
About you:
Support the Renewals team with exceeding monthly/quarterly financial targets
Responsible for the quoting of Maintenance/Subscription Renewals for an assigned territory
Supervise email requests, tasks, and questions received in a general mailbox and taking the correct action on them in a timely fashion
Expected to become a Super User for renewal quoting processes
Work with the Renewals Team to package and present quoting proposals to customers
Comfort with quoting complex contracts for multiple products with usage and price increases
Provide timely proposals and quotes in line with terms of customer and/or partner agreements
Capture, maintain, and disseminate accurate and relevant information using Salesforce.com
Assist with forecasting renewal pricing and multi-year options
Work collaboratively with internal resources such as Sales Operations, Finance, and Legal to process renewals per company guidelines
Also, a nice to have is:
3+ years’ experience in purchasing, operations, or renewing technology solutions
Proficient with Microsoft Excel and a CRM system like Salesforce.com
Demonstrated history of meeting performance targets
Comfort quoting and managing a large volume of transactions
Highly organized with strong attention to detail
Strong oral, written and presentation skills
Strong time management, organizational and decision-making skills
Ability to work independently and collaboratively in a team environment
A passion for problem-solving, comfort with ambiguity and creativity
Motivated to succeed and participate in the growth of an exciting, fast-paced SaaS company
About GlobalLogic:
GlobalLogic is a Hitachi Group Company, leader in digital engineering. Based across 16 countries. We help brands across the globe design and build innovative products, platforms, and digital experiences for the modern world. By integrating experience design, complex engineering, and data expertise—we help our clients imagine what’s possible and accelerate their transition into tomorrow’s digital businesses. Headquartered in Silicon Valley, GlobalLogic operates design studios and engineering centers around the world, extending our deep expertise to customers in the automotive, communications, financial services, healthcare and life sciences, manufacturing, media and entertainment, semiconductor, and technology industries.
GlobalLogic is operating under Hitachi, Ltd. (TSE: 6501) which contributes to a sustainable society with a higher quality of life by driving innovation through data and technology as the Social Innovation Business
Our Benefits
100% Payroll
Major medical insurance & life insurance
30 days of christmas bonus
12 days of vacations
saving fund 13%
food vouchers
Restaurants vouchers
and more…"
Analista de Cultura y Vida - MID,Analista de Cultura y Vida - MID,Concentrix Limited Company,June,2024,"Apply Now

Promover la cultura organizacional por medio de la ejecución de las diferentes actividades de cultura y vida, logrando el desarrollo de la cultura Game Changer.

Actividades

Ejecutar actividades del cronograma mensual, garantizando el cumplimiento de los proyectos establecidos por el área.
Mantener comunicación permanente con los Game Changers para facilitar el uso de los beneficios, programas o actividades disponibles.
Realizar reportes de gestión semanales, por medio de la verificación de los resultados y su alcance,
Orientar a los Game Changers en la utilización de recursos institucionales y externos, funcionamiento de convenios.

Requisitos

Lic en psicología, Administración de empresas o carrera a fin.
Experiencia de al menos 1 año en desarrollo organizacional.
Conocimientos de cultura y clima organizacional
Disponibilidad 100% on site
Manejo de Excel Básico
Actitud de servicio

Beneficios

Oportunidades de crecimiento y desarrollo profesional
Excelente ambiente laboral
Beneficios adicionales a los de ley

Apply Now"
Wellness Analyst,Wellness Analyst,PepsiCo,May,2024,"Overview

We Are PepsiCo

Join PepsiCo and Dare for Better! We are the perfect place for curious people, thinkers and change agents. From leadership to front lines, we're excited about the future and working together to make the world a better place.

Being part of PepsiCo means being part of one of the largest food and beverage companies in the world, with our iconic brands consumed more than a billion times a day in more than 200 countries.

Our product portfolio, which includes 22 of the world's most iconic brands, such as Sabritas, Gamesa, Quaker, Pepsi, Gatorade and Sonrics, has been a part of Mexican homes for more than 116 years.

A career at PepsiCo means working in a culture where all people are welcome. Here, you can dare to be you. No matter who you are, where you're from, or who you love, you can always influence the people around you and make a positive impact in the world.

Know more: PepsiCoJobs

Join PepsiCo, dare for better.

Responsibilities

The Opportunity

This role will be responsible of the implementation of Wellness events and activities across LatAm tailored to the specific needs of each population in order to drive a cultural change focused on the development of healthy lifestyles: events like Reinventate Challenge, pepsico race and mental health week, Bienestars program, nutrition workshops, etc.

Your Impact

As Wellness Analyst your functions would consist of:

Coordination of virtual and on-site Wellness Programs and events in Mexico and LATAM.
Coordination and follow-up with vendors of the programs and activities wellness.
Collabotarion with intern areas in Pepsico: marketing, nutrition, legal, budget, etc.
Registration and monitoring of participation indicators and impact results.
Actively participate in the activities of the wellness agenda.

Qualifications

¿Who Are We Looking For?

BSc on Nutrition.
At least 4 years of experience on design and implementation of wellness events, programs and activities.
Wide knowledge on health promotion and chronic diseases.
Excellent management of information bases and impact analysis.
Fluid English written and spoken.
Portuguese as added value.

If this is an opportunity that interests you, we encourage you to apply even if you do not meet 100% of the requirements.

What can you expect from us:

Opportunities to learn and develop every day through a wide range of programs.
Internal digital platforms that promote self-learning.
Development programs according to Leadership skills.
Specialized training according to the role.
Learning experiences with internal and external providers.
We love to celebrate success, which is why we have recognition programs for seniority, behavior, leadership, moments of life, among others.
Financial wellness programs that will help you reach your goals in all stages of life.
A flexibility program that will allow you to balance your personal and work life, adapting your working day to your lifestyle.
And because your family is also important to us, they can also enjoy benefits such as our Wellness Line, thousands of Agreements and Discounts, Scholarship programs for your children, Aid Plans for different moments of life, among others.

We are an equal opportunity employer and value diversity at our company. We do not discriminate based on race, religion, color, national origin, gender, sexual orientation, age, marital status, veteran status, or disability status. We respect and value diversity as a work force and innovation for the organization."
C&B Analyst,C&B Analyst,NielsenIQ,June,2024,"Company Description

REFID727675

Our NielsenIQ Technology teams are working on our new “Connect” platform, a unified, global, open data ecosystem powered by Microsoft Azure. Our clients around the world rely on NielsenIQ’s data and insights to innovate and grow.

As a C&B Analyst, you’ll be part of a team of smart, highly skilled technologists who are passionate about learning and prototyping cutting-edge technologies. Our team is co-located and agile, with central technology hubs in Chicago, Madrid, Toronto and Chennai.

Job Description

Participates in all benefits renewal meetings across the Latam region, supporting the local C&B and HR team
Maintain constant communication with the broker’s points of contact in order to anticipate all benefit renewals aiming to contribute in closing the best deal for the company
Keep records and KPIs of benefits changes for each country in the region
Assist Senior C&B Analyst in Mexico with all local Mexican day-to-day compensation activities as required
Organize and facilitate working sessions on specific benefit issues, providing templates & arranging for feedback where needed to contribute on the normal performance of the benefits that applies for each country

Qualifications

English communication skills
Regional experience preferred
Compensation and Benefits experience preferred
Confidence and ability to form strong relationships with stakeholders preferred
HR experience (Payroll, C&B, People experience, etc.) (preferred)

Additional Information

Our Benefits

Flexible working environment
Volunteer time off
LinkedIn Learning
Employee-Assistance-Program (EAP)

About NIQ

NIQ is the world’s leading consumer intelligence company, delivering the most complete understanding of consumer buying behavior and revealing new pathways to growth. In 2023, NIQ combined with GfK, bringing together the two industry leaders with unparalleled global reach. With a holistic retail read and the most comprehensive consumer insights—delivered with advanced analytics through state-of-the-art platforms—NIQ delivers the Full View™. NIQ is an Advent International portfolio company with operations in 100+ markets, covering more than 90% of the world’s population.

For more information, visit NIQ.com

Want to keep up with our latest updates?

Follow us on: LinkedIn | Instagram | Twitter | Facebook

Our commitment to Diversity, Equity, and Inclusion

NIQ is committed to reflecting the diversity of the clients, communities, and markets we measure within our own workforce. We exist to count everyone and are on a mission to systematically embed inclusion and diversity into all aspects of our workforce, measurement, and products. We enthusiastically invite candidates who share that mission to join us. We are proud to be an Equal Opportunity/Affirmative Action-Employer, making decisions without regard to race, color, religion, gender, gender identity or expression, sexual orientation, national origin, genetics, disability status, age, marital status, protected veteran status or any other protected class. Our global non-discrimination policy covers these protected classes in every market in which we do business worldwide. Learn more about how we are driving diversity and inclusion in everything we do by visiting the NIQ News Center: https://nielseniq.com/global/en/news-center/diversity-inclusion"
