Position,Company_Name,Location,Post_Month,Post_Year,Details
SCM Launch & Change Management Specialist,SCM Launch & Change Management Specialist,Continental,May,2024,"Company Description

Continental develops pioneering technologies and services for sustainable and connected mobility of people and their goods. Founded in 1871, the technology company offers safe, efficient, intelligent and affordable solutions for vehicles, machines, traffic and transportation. In 2022, Continental generated sales of €39.4 billion and currently employs around 200,000 people in 57 countries and markets.

Job Description

Responsible for ensuring stable launch, change and sourcing processes and for coordinating the supply chain related and SAP based Material Master Data of a product or components.

Qualifications

Bachelor's degree
Intermediate English
Experience:
In industry
In Logistics area
Knowledge:
Purchasing process (desirable)
SAP or similar ERP
Led a first Logistics or interface project
Additional Information

At Continental we are committed to building an inclusive and discrimination-free ecosystem in Mexico, these principles are rooted in our corporate philosophy and culture. Therefore, it is totally forbidden to request a pregnancy or HIV test as part of our selection processes.

Ready to drive with Continental? Take the first step and fill in the online application."
Change Management and Market Development Manager,Change Management and Market Development Manager,Thermo Fisher Scientific,June,2024,"We are seeking a skilled and motivated individual to join our team as a Change Management and Marketing Manager. In this role, you will be responsible for overseeing change management and marketing activities for the Fisher Scientific eCommerce site, as well as managing eProcurement marketing needs across thermofisher.com and fishersci.com. Your primary goal will be to ensure a seamless customer experience, optimize user adoption, and drive business growth through effective change management strategies and targeted marketing efforts.

Responsibilities:

Develop and implement change management strategies to support the successful rollout of updates, enhancements, and new features on the Fisher Scientific eCommerce site.
Collaborate with cross-functional teams, including product, marketing, and sales, to ensure alignment and effective execution of change management initiatives.
Conduct impact assessments and stakeholder analyses to identify potential risks and develop mitigation plans.
Create and deliver training materials, workshops, and presentations to educate internal stakeholders and customers on changes and improvements to the eCommerce platform.
Monitor and analyze user feedback, behavior, and adoption metrics to identify areas for improvement and optimize the user experience.
Develop and execute communication strategies, including email campaigns, website announcements, emails, and social media posts, to inform users about website updates and enhancements
Drive content updates for website enhancements, ensuring that all changes are effectively updated within website content, and communicated to internal stakeholders and customers
Collaborate with marketing teams to develop and execute marketing campaigns and initiatives to drive customer engagement, adoption, and overall customer experience.
Collaborate with the eProcurement team to ensure seamless integration and functionality between thermofisher.com, fishersci.com, and other eProcurement platforms.
Utilize data-driven insights to develop targeted change management and marketing strategies and be able to pivot and optimize strategies when needed.

Qualifications:

Bachelor's degree in marketing, business, or a related field. Master's degree is a bonus
Proven experience in change management, downstream marketing, supporting digital platforms.
Strong project management skills with the ability to prioritize and manage multiple initiatives simultaneously.
Excellent communication and presentation skills, with the ability to effectively convey information to both technical and non-technical audiences.
Analytical mindset with the ability to interpret data and make data-driven decisions.
Experience with eProcurement platforms is a plus.
Strong problem-solving skills and ability to adapt to changing business needs.
Ability to work collaboratively in a cross-functional team environment.
If you are a highly motivated individual with a passion for change management, marketing, and eCommerce, and possess the necessary skills and qualifications, we invite you to apply for this exciting opportunity. Join our team and contribute to driving the success of Thermo Fisher Scientific."
ITSM Release Change Manager Service Desk Bilingue,ITSM Release Change Manager Service Desk Bilingue,Training Talent,June,2024,"Esta vacante viene de la bolsa de empleo Talenteca.com

Vacante para la empresa Training Talent en Gustavo A. Madero, Ciudad de México

Sobre nosotros

Somos una empresa 100% mexicana, dedicada al soporte a misión crítica (aplicaciones, servidores, servicios de TI trabajamos con clientes del sector financiero, bancario y retail, nos diferenciamos por el apego a procesos y el enfoque en las personas. Actualmente, buscamos para nuestro equipo en CDMX Release Manager para soporte a proyectos a EEUU

Con Nosotros, Tendrás La Oportunidad De

Recibir mucha capacitación, certificaciones y crecimiento real.
Liderar, Planificar y coordinar el ciclo de vida completo de los lanzamientos de software, hasta la implementación y evaluación post implementación.
Colaborar con los equipos de desarrollo y operaciones para definir y documentar los requisitos de lanzamiento, incluyendo la identificación de dependencias, riesgos y recursos necesarios.
Desarrollar y mantener procesos y procedimientos de lanzamiento estandarizados, siguiendo las mejores prácticas de ITSM.

Nuestra propuesta de trabajo

Ofrecemos Solidez Financiera, Estabilidad Profesional y Siempre Entrenamiento, Buscamos Generar Un Equipo De Trabajo Multicultural, Colaborativo e Innovador, Además Nuestra Oferta Incluye

Ingreso de 32,000 a 33,000 pesos libres (Contratación directa) vales despensa, ticket de restaurante, seguro de vida, 18 días de aguinaldo, 30% prima vacacional
Horario de lunes a viernes 9 a 6 p m
Zona de trabajo: Insurgentes Sur y Home Office (2 a 3 días en oficina inicialmente)

Qué buscamos

Más de 2 año de experiencia mínima como: Soporte ITIL, help desk ITIL Expert, Service desk ITIL Expert, mesa de ayuda release manager, consultor de cambios, IT Consultant, Analista de versionamiento, reléase specialist
Inglés conversacional para atención a tickets con cliente.
Muy deseable cursos o certificaciones como ITIL v3/v4 Expert.
Experiencia con herramientas IT como ServiceNow, BMC Remedy, Tivoli, etc.
2 años en manejo o conocimientos sólidos de los principios y prácticas de ITIL (Information Technology Infrastructure Library), especialmente en el área de Gestión de Cambios y Gestión de Lanzamientos.
2 años de experiencia en herramientas de automatización y gestión de configuración, como Jenkins, Git, Ansible, etc.
Manejo de premisas en Change Management y Release Management. (elaboración de reportes causa raíz)
Documentación de escalaciones, elaboración de scripts y procesos técnicos.
Muy deseable: Cursos o capacitaciones de procesos o normas ISO, ITIL; Scrum o PMP

Nivel De Educación Deseada

Superior - trunco

Nivel De Experiencia Deseada

Nivel Medio

Función Departamental

Tecnología / Internet

Industria

Telecomunicaciones

Habilidades

ITSM
release manager
change manager
itil
Service Manager

Esta Vacante Viene De La Bolsa De Empleo Talenteca.com

https://www.talenteca.com/anuncio?j_id=665b49bb240000520075b54a&source=linkedin"
ITSM Release Change Manager Service Desk Bilingue,ITSM Release Change Manager Service Desk Bilingue,Training Talent,June,2024,"Esta vacante viene de la bolsa de empleo Talenteca.com

Vacante para la empresa Training Talent en Tlalpan, Ciudad de México

Sobre nosotros

Somos una empresa 100% mexicana, dedicada al soporte a misión crítica (aplicaciones, servidores, servicios de TI trabajamos con clientes del sector financiero, bancario y retail, nos diferenciamos por el apego a procesos y el enfoque en las personas. Actualmente, buscamos para nuestro equipo en CDMX Release Manager para soporte a proyectos a EEUU

Con Nosotros, Tendrás La Oportunidad De

Recibir mucha capacitación, certificaciones y crecimiento real.
Liderar, Planificar y coordinar el ciclo de vida completo de los lanzamientos de software, hasta la implementación y evaluación post implementación.
Colaborar con los equipos de desarrollo y operaciones para definir y documentar los requisitos de lanzamiento, incluyendo la identificación de dependencias, riesgos y recursos necesarios.
Desarrollar y mantener procesos y procedimientos de lanzamiento estandarizados, siguiendo las mejores prácticas de ITSM.

Nuestra propuesta de trabajo

Ofrecemos Solidez Financiera, Estabilidad Profesional y Siempre Entrenamiento, Buscamos Generar Un Equipo De Trabajo Multicultural, Colaborativo e Innovador, Además Nuestra Oferta Incluye

Ingreso de 32,000 a 33,000 pesos libres (Contratación directa) vales despensa, ticket de restaurante, seguro de vida, 18 días de aguinaldo, 30% prima vacacional
Horario de lunes a viernes 9 a 6 p m
Zona de trabajo: Insurgentes Sur y Home Office (2 a 3 días en oficina inicialmente)

Qué buscamos

Más de 2 año de experiencia mínima como: Soporte ITIL, help desk ITIL Expert, Service desk ITIL Expert, mesa de ayuda release manager, consultor de cambios, IT Consultant, Analista de versionamiento, reléase specialist
Inglés conversacional para atención a tickets con cliente.
Muy deseable cursos o certificaciones como ITIL v3/v4 Expert.
Experiencia con herramientas IT como ServiceNow, BMC Remedy, Tivoli, etc.
2 años en manejo o conocimientos sólidos de los principios y prácticas de ITIL (Information Technology Infrastructure Library), especialmente en el área de Gestión de Cambios y Gestión de Lanzamientos.
2 años de experiencia en herramientas de automatización y gestión de configuración, como Jenkins, Git, Ansible, etc.
Manejo de premisas en Change Management y Release Management. (elaboración de reportes causa raíz)
Documentación de escalaciones, elaboración de scripts y procesos técnicos.
Muy deseable: Cursos o capacitaciones de procesos o normas ISO, ITIL; Scrum o PMP

Nivel De Educación Deseada

Superior - trunco

Nivel De Experiencia Deseada

Nivel Medio

Función Departamental

Tecnología / Internet

Industria

Telecomunicaciones

Habilidades

ITSM
release manager
change manager
itil
Service Manager

Esta Vacante Viene De La Bolsa De Empleo Talenteca.com

https://www.talenteca.com/anuncio?j_id=665b21ef230000430092d460&source=linkedin"
