Position,Company_Name,Location,Post_Month,Post_Year,Details
Customer Experience Project Mgr,Customer Experience Project Mgr,Schneider Electric,June,2024,"Creative, energetic and self-driven, individual who understands the customer and their use cases and knows how to be a trusted partner to internal stakeholders & is strong in customer facing interactions. Enjoys change management, understanding root causes of problems and functions as the voice of the customer in strategic decisions that impact customer experience.

The employee has the emotional intelligence to be able to address emergency customer situations under pressure and articulate well to customers. Adept at problem solving and change management that enables the business meet new levels of loyalty that enables profitable growth.

Proactive program management is also expected for areas that prove beneficial to advancing the customer experience or business goals. This person will be accountable to create, develop and maintain high-level relationships inside Schneider Electric with the business operations leaders, lines of businesses, global supply chain & in some cases technical leaders. Utilizes customer knowledge to educate internally on customer personas, touch points and understands drivers around customer satisfaction.

He/she partners with customers, commercial teams in operations, global supply chain & demonstrates strong business orientation and capability to solve complex customer issues with a sense of urgency while representing customer’s voice as the priority to issue resolution.

Responsible for improving the experiences customers have with organizations, with the goal of increasing customer satisfaction.
Process and continuous improvement minded & solve problems to optimize all customer interactions.
Root cause analysis & LEAN thinking
Applies change management techniques to get buy-in internally on programs
Analyzes C/Rs and recommends proactive actions to predict customer pain points and address proactively
Proactive program management- including introducing CX programs and customer councils in key segments
Customer Experience Journey Mapping
Identifies and networks with internal business leaders/stakeholders to build strong relationships and can gain access to relevant staff meetings to highlight customer satisfaction & key initiatives for advancing customer experience
Collaborates with External sales, Inside Sales, Service representations and the business unit lines of business customer satisfaction & quality network to solve customer major issues and escalated situations.
‘Dare to Disrupt’ mindset to bring new ideas & insights to problem solving
Apply change management techniques to establish a culture of ‘Customer First’ and drive adoption of tools/processes that enable sustainable, profitable growth
Digital mindset to innovate with new solutions that improve customer experience or processes
Self-motivated team player who has fresh ideas and energy
Enjoys working closely with customers to ensure complete satisfaction and earning trust
Consulting experience a strong plus
Strong communication skills
Other duties may be assigned

Qualifications

Education:

Business Degree, Engineering or equivalent experience; MBA a plus

Working Experience:

Six Sigma certifications a plus and minimum of 5 years in customer support, execution of projects, sales or equivalent experience related to change management
Strong business acumen & results orientation
Confidence and courage to make appropriate decisions and accept accountability to drive change

Business Understanding:

Capacity to understand Schneider Electric’s products/solutions/services and competitors.

Others (e.g. language skills, technical skills):

Excellent verbal and written communication skills to effectively connect with high level decision makers and influencers inside and outside organization.
Prior experience as project manager or successful leader of large initiatives is a plus
Proficient in Microsoft Office suite. Excellent organizational skills.
Analytical skills & Tableau experience a plus but not required.
Self-starter
Good analytical skills
Autonomous with team spirit
Tenacity, resilience, emotional intelligence

Qualifications

Creative, energetic and self-driven, individual who understands the customer and their use cases and knows how to be a trusted partner to internal stakeholders & is strong in customer facing interactions. Enjoys change management, understanding root causes of problems and functions as the voice of the customer in strategic decisions that impact customer experience.

The employee has the emotional intelligence to be able to address emergency customer situations under pressure and articulate well to customers. Adept at problem solving and change management that enables the business meet new levels of loyalty that enables profitable growth.

Proactive program management is also expected for areas that prove beneficial to advancing the customer experience or business goals. This person will be accountable to create, develop and maintain high-level relationships inside Schneider Electric with the business operations leaders, lines of businesses, global supply chain & in some cases technical leaders. Utilizes customer knowledge to educate internally on customer personas, touch points and understands drivers around customer satisfaction.

He/she partners with customers, commercial teams in operations, global supply chain & demonstrates strong business orientation and capability to solve complex customer issues with a sense of urgency while representing customer’s voice as the priority to issue resolution.

Responsible for improving the experiences customers have with organizations, with the goal of increasing customer satisfaction.
Process and continuous improvement minded & solve problems to optimize all customer interactions.
Root cause analysis & LEAN thinking
Applies change management techniques to get buy-in internally on programs
Analyzes C/Rs and recommends proactive actions to predict customer pain points and address proactively
Proactive program management- including introducing CX programs and customer councils in key segments
Customer Experience Journey Mapping
Identifies and networks with internal business leaders/stakeholders to build strong relationships and can gain access to relevant staff meetings to highlight customer satisfaction & key initiatives for advancing customer experience
Collaborates with External sales, Inside Sales, Service representations and the business unit lines of business customer satisfaction & quality network to solve customer major issues and escalated situations.
‘Dare to Disrupt’ mindset to bring new ideas & insights to problem solving
Apply change management techniques to establish a culture of ‘Customer First’ and drive adoption of tools/processes that enable sustainable, profitable growth
Digital mindset to innovate with new solutions that improve customer experience or processes
Self-motivated team player who has fresh ideas and energy
Enjoys working closely with customers to ensure complete satisfaction and earning trust
Consulting experience a strong plus
Strong communication skills
Other duties may be assigned

Qualifications

Education:

Business Degree, Engineering or equivalent experience; MBA a plus

Working Experience:

Six Sigma certifications a plus and minimum of 5 years in customer support, execution of projects, sales or equivalent experience related to change management
Strong business acumen & results orientation
Confidence and courage to make appropriate decisions and accept accountability to drive change

Business Understanding:

Capacity to understand Schneider Electric’s products/solutions/services and competitors.

Others (e.g. language skills, technical skills):

Excellent verbal and written communication skills to effectively connect with high level decision makers and influencers inside and outside organization.
Prior experience as project manager or successful leader of large initiatives is a plus
Proficient in Microsoft Office suite. Excellent organizational skills.
Analytical skills & Tableau experience a plus but not required.
Self-starter
Good analytical skills
Autonomous with team spirit
Tenacity, resilience, emotional intelligence

Schedule: Full-time

Req: 008XZ8"
"Senior Program Manager, International Supply Chain","Senior Program Manager, International Supply Chain",myGwork - LGBTQ+ Business Community,May,2024,"This inclusive employer is a member of myGwork – the largest global platform for the LGBTQ+ business community.

Description

Amazon Mexico´s Int´l Supply Chain team is looking for a Senior Program Manager to provide both tactical and strategic leadership for import and inbound transportation programs as well as to drive launch of new programs and manage projects in the International supply chain field. You will also require to support existing operations and identify, create, develop and integrate innovative solutions that lead to improvements, scalability and efficiency in our supply chain. We are looking for a motivated self-starter that can work independently in a fast paced, ambiguous environment.

Key job responsibilities

The Senior Program Manager key responsibilities are

To identify opportunities for new programs, prepare and effectively drive business case discussions to justify investments and drive implementation of new programs or projects.
Work with product, operations, technology and partner teams to identify cost reduction and cost avoidance opportunities.
Identify and address customer and business pain points and process optimization opportunities by deep diving data, operational processes and working with cross-functional teams.
Set up milestones, goals to measure progress and report on them.
Influence without authority by communicating effectively, verbally and in writing, to a wide range of audiences including Directors and VPs.

We are open to hiring candidates to work out of one of the following locations:

Mexico City, DIF, MEX

Basic Qualifications

6+ years of program or project management experience
Experience using data and metrics to determine and drive improvements
Experience owning program strategy, end to end delivery, and communicating results to senior leadership
5+ years of working cross functionally with tech and non-tech teams experience
English Advance C1+
Bachelors degree

Preferred Qualifications

2+ years of driving process improvements experience
Master's degree, or MBA in business, operations, human resources, adult education, organizational development, instructional design or related field
PMP certificate"
"Program Manager, Supply Chain Management","Program Manager, Supply Chain Management",Amazon,May,2024,"Description

At Amazon, we're working to be the most customer-centric company on earth. To get there, we need exceptionally talented, bright, and driven people. If you'd like to help us build the place to find and buy anything online, this is your chance to make history.

The Startup Procurement team manages the flow of materials to new sites by monitoring and mitigating supply risk. Our Sr. Program Manager, Startup Procurement role will work with various functional partners to make sure that items are ordered and delivered to sites just in time. The role will also review existing processes and continuously improve them by scaling, automation, etc.

#AmazonMexico

Key job responsibilities

onitor and mitigate overall risk for all new launches buildings

Continuously improve current processes

Identify and/or eliminate project related barriers for team members and partners

Communicate building launch plans with Category, Procurement Operations teams, and cross-functional organizations

Establish initial procurement order streams to match supply with demand on a Just-in-Time (JIT) basis.

Collaborate with suppliers and establish monitoring processes, where applicable, to ensure timely deliveries and quality compliance

Ensure Procurement’s resource requirements are met in all new site launches

Define key performance indicators – develop metrics and service level agreements for core programs and processes, and track delivery against program objectives

Interface with Procurement Operations to implement best practices and ensure consistency across buildings

Partner with internal customers to positively influence spending decisions

Drive execution of vision and goals for the team

Develop sustainable training as needed for new project/program launches

Manage multiple, competing projects and priorities simultaneously

Travel up to 50% domestically and internationally

Key job responsibilities

Plan and scope monthly discovery audits, execute audits, prepare written findings, and facilitate business responses and action items.
Delve deep into the details to generate meaningful findings and recommend root cause solutions.
Lead regional workshops to reinforce standards.
Create short impactful videos to document best practices.
Lead and participate in ad hoc projects.

We are open to hiring candidates to work out of one of the following locations:

Mexico City, DIF, MEX

Basic Qualifications

2+ years of working cross functionally with tech and non-tech teams experience
2+ years of defining and implementing process improvement initiatives using data and metrics experience
Bachelor's degree
Knowledge of Excel at an intermediate level (e.g., pivot tables & charts, multiple criteria lookups, nested logical/IF formulas, data cleansing, array formulas, etc.)
Experience defining program requirements and using data and metrics to determine improvements
Willingness to travel up to 50% (excluding less than one-hour commute from home).

Preferred Qualifications

3+ years of driving end to end delivery, and communicating results to senior leadership experience
3+ years of driving process improvements experience
Experience in stakeholder management, dealing with multiple stakeholders at varied levels of the organization
Experience building processes, project management, and schedules


Company - Servicios Comerciales Amazon Mexico S. de R.L. de C.V.

Job ID: A2563923"
ICI50CI51-DIRE-LE-05-DIRECTOR SR PROYECTOS Y MEJORA CONTINUA,ICI50CI51-DIRE-LE-05-DIRECTOR SR PROYECTOS Y MEJORA CONTINUA,Truper,March,2024,"Objetivo del puesto

Gestión integral del Portafolio de Proyectos de Iniciativas de Mejora alineadas a los objetivos institucionales.

Perfil General del puesto

Horario laboral: Mixto

Educación

Estudios Universitarios pasante

Experiencia requerida

Experiencia de 5 años o más

Principales funciones del puesto

Administrar y priorizar un portafolio de proyectos diversos de la Banca Mayorista con metodologías ágiles manteniendo alineación a los objetivos institucionales a corto, mediano y largo plazo. Análisis de información de datos para identificar interacciones que generen la transformación de procesos en beneficios de productos o servicios ofrecidos a los clientes. Diseñar, gestionar e implementar métricas e indicadores de desempeño para la evaluación sistemática de las mejoras implementadas.

Competencias requeridas

Habilidades

Certificados"
Administrador de Proyectos TI Gubernamental,Administrador de Proyectos TI Gubernamental,ROM Refacciones,May,2024,"Empresa líder en Servicios de tecnología busca tu talento:

Administrador de Proyectos Máster TI /

Requisitos

Licenciatura en Informática, tecnologías de la información, Ing. Industrial, sistemas computacionales, administración, economía, o afín. (Título y cedula indispensable)
Certificación en ITIL Foundations y/o ITIL Expert, PMP, SCRUM MÁSTER vigentes
Experiencia de 5 años en puesto similar
Conocimiento de metodologías ágiles
Dirección de Proyectos y aplicación de metodologías ágiles

Actividades Generales

Gestión de programas y proyectos TI / Gubernamental.
Servicio al cliente
Implementación de metodologías ágiles TI
Administración y operación de proyectos de TI y comunicación
Lugar de trabajo: Col. Del valle centro, Benito Juárez
$45,000 mensuales
L – V 09:00 – 19:00
Prestaciones de Ley
Seguro de gastos médicos menores
Seguro de vida
Acceso a totalpass (GYM, actividades recreativas, con costo preferencial)
Oportunidad de crecimiento""Durante nuestros procesos de Reclutamiento, Contratación o Ascenso se prohibe la discriminación en función de raza, color, edad, género, orientación/preferencia sexual, etnia, discapacidad, religión, afiliación política o sindical, origen nacional, estado civil, identidad de género, condición social, condiciones de salud, condición migratoria y/o opiniones""

Se prohíbe como requisito para participar en cualquier proceso de ingreso, permanencia o ascenso en el empleo, el solicitar certificados médicos de: a) No embarazo o b) Virus de Inmunodeficiencia Humana (VIH)"
New Products Project Program Manager,New Products Project Program Manager,HP,April,2024,"Expert knowledge across supply chain including technologies, theories and techniques. Contributes to the development of innovative principles and ideas. Successfully leads and drives complex programs across the business. Provides highly innovative solutions. Leads large, cross-division functional teams or projects that enhance the overall business performance. Participates in cross-division, multi-function teams. Provides mentoring and guidance to employees. Accountable for developing methods, techniques and criteria for achieving objectives. Develops strategy and sets functional policy and direction.

Responsibilities

Manages and leads key programs involving multiple functions to develop and enhance the overall business performance.
Directs the development of overall program strategy, budgets, resource allocation plans, and general program requirements for the business.
Leads all activities across program teams with accountable for overall program performance.
Communicates program progress, escalations, and issue analysis to stakeholders; collaborates with internal partners to recommend and implement changes to products, processes, or business practices to drive continuous improvement.
Develops and leads operational reviews.
Drives innovation and integration of new technologies and initiatives.
Reviews, evaluates, and enhances processes through continuous assessment. Provides tangible feedback to improve overall program management quality and results for the organization.
Provides guidance and mentoring to cross functional team members.

Education And Experience Required

Bachelor's or Master's degree in Business Management, Engineering, Computer Sciences, or equivalent.
15+ years supply chain experience.
10+ years experience leading or managing teams.
PMP/PMI certification preferred

Knowledge And Skills

Experience designing and developing program planning tools to create, manage, and track project results.
Excellent analytical and problem solving skills.
Demonstrated business acumen, understanding of organizational strategy, experience managing cross-functional programs.
Excellent communication skills.
Leading cross functional teams.
Ability to effectively communicate program management and negotiate options across multiple functions."
"Program Operational Excellence Manager, EF LatAm Operational Excellence","Program Operational Excellence Manager, EF LatAm Operational Excellence",Amazon,May,2024,"Description

Amazon strives to be Earth's most customer-centric company where people can find and discover virtually anything they want to buy online. By giving customers more of what they want - low prices, vast selection, and convenience, Amazon continues to grow and evolve as a world-class e-commerce platform. Amazon's evolution from Web site to e-commerce partner to development platform is driven by the spirit of innovation that is part of the company's DNA. Amazon’s vision is to offer the earth’s largest selection and lowest prices to our customers.

The Program Operational Excellence Manager will lead a team in one of the Marketplace fulfillment programs expansion in Mexico. The job requires someone who has a larger picture of customer and seller experience in mind and a high willingness to take ownership. You will be responsible for ensuring a world class Seller experience in one of Amazon’s fastest growing business and highest impact initiatives. You will work with internal areas such as Operations, Transportation, Legal, Sales and Seller Support, and a variety of internal and external partners to ensure the smooth growth and long-term sustainability of the business.

The right candidate will possess a strong bias for action to proactively pursue program objectives and analytical mindset for finding root cause and proposing solutions as well as good people management skills in order to be able to contribute to be the world's best employer. You must be able to thrive and succeed in an entrepreneurial environment and not be hindered by ambiguity or competing priorities.

Basic Qualifications

Bachelor's degree
+3 years of Program or Project management
Excel (Advanced)
SQL (Intermediate)
English (Fluent/Advanced)

Preferred Qualifications

MBA degree
Python or other programming skills
People management

Key job responsibilities

To Succeed As Program Manager You Need To

Be able to excel in stakeholder management in different areas and levels - specially with Operations and Transportation teams;
Be able to conduct multiple projects at the same time directly and indirectly with different levels of complexity and extensions;
Coach your team in order to prioritize tasks to optimize results, creating value in the long-term;
Challenge current status-quo of the existing mechanisms in order to create a continuous improvement environment;
Influence your team and others to create new procedures and processes.

A day in the life

Inclusive team culture

At Amazon we embrace our differences and we are committed to furthering our culture of inclusion. We host annual and ongoing learning experiences. Amazon’s culture of inclusion is reinforced within our 14 Leadership Principles, which remind team members to seek diverse perspectives, learn and be curious, and earn trust

Work Life Balance

We believe striking the right balance between your personal and professional life is critical to life-long happiness and fulfillment. We offer flexibility in working hours and encourage you to find your own balance between your work and personal lives.

Mentorship & Career Growth

Our team is dedicated to supporting new members. We have a broad mix of experience levels and tenures, and we’re building an environment that celebrates knowledge sharing and mentorship. We care about your career growth and strive to assign projects based on what will help each team member develop into a better-rounded professional.

We are open to hiring candidates to work out of one of the following locations:

Mexico City, DIF, MEX

Basic Qualifications

Bachelor's degree
3+ years of program or project management experience
Knowledge of Microsoft Excel (macros, pivots, lookups) at an advanced level

Preferred Qualifications

Experience managing teams


Company - Servicios Comerciales Amazon Mexico S. de R.L. de C.V.

Job ID: A2605642"
