Position,Company_Name,Location,Post_Month,Post_Year,Details
Analista de asuntos públicos y de gobierno,Analista de asuntos públicos y de gobierno,Mondelēz International,June,2024,"Job Description

Are You Ready to Make It Happen at Mondelēz International?

Join our Mission to Lead the Future of Snacking. Make It Matter.

You will execute communications activities including publishing, measurement coordination and other operational activities across internal and/or external channels.

How You Will Contribute

In this role, you will execute media relations, government affairs, internal communications and community engagement activities across markets. You will monitor and measure communication channels and/or advocacy activity, including but not limited to traditional media, social media, media hotlines, lobbying audit and more. In addition, you will support operational activities to deliver key internal and external communication priorities, including content development and event planning execution, collaborate with colleagues to share best practices, and ensure activities are delivered within budget.

What You Will Bring

A desire to lead the future for our company and accelerate you career with experience and knowledge in:

Professional office experience in a large, matrix multinational company
Interest in communications or government affairs and issues management
Achieving results, attention to details and working under pressure with a collaborative approach
Analytical and time management skills
Excellent written and spoken communication
Learning agility to leverage digital tools and systems such as MS Office applications, SharePoint, design and video editing software


More About This Role

You will execute public & government affairs activities including high-level networking, political profile analysis, political scenarios creation, ESG communication and other operational activities across internal and/or external channels.

Education / Certifications:

Bachelor’s degree in Political Science or International Affairs.

Job specific requirements:

2+ year on political affairs consultancy.
Previous roles creating political profiles, interacting with NGOs and high-level profiles.
1+ year on ESG roles.
Specific academic papers & studies about the current administration in Mexico.


Travel requirements:

50% travel

No Relocation support available

Business Unit Summary

Mondelez México has been in the country since 1927 and currently employs 6,000 wonderful people. Our diverse portfolio includes iconic and mouth-watering global brands such as Trident, Oreo, Philadelphia, and local jewels like Clorets and Bubbaloo. We are leaders in the making of cream cheese, powdered beverages and confections—in fact, we make seven out of every 10 chewing gums consumed by Mexicans. Our growth is supported by our cutting-edge manufacturing facilities, such as our Puebla Plant and Nuevo León HUB, which are the largest gums, candies and biscuits factories in the world in terms of volume. You can buy are products in 900,000 places in Mexico. We are also home to one of the 11 technology centers Mondelez International has worldwide, a specialized gum and candy facility that places us at the forefront of innovation and development in the country and drives our purpose to lead the future of snacking. We are pioneers in the country in work-life balance practices such as extended maternity leave, open spaces, remote work and flexible working hours.

Mondelēz International is an equal opportunity employer and all qualified applicants will receive consideration for employment without regard to race, color, religion, gender, sexual orientation or preference, gender identity, national origin, disability status, protected veteran status, or any other characteristic protected by law.

Job Type

Regular

Communications and Public & Government Affairs

Corporate & Government Affairs"
US Analyst,US Analyst,Spencer Stuart,May,2024,"The designated person will operate as a thought partner to both the practice leadership and client servicing teams, and be responsible for delivering high quality, thorough research, and related materials in response to new business requests.

Is responsible for supporting pitch and search strategies by producing industry and/or functional analysis reports and talent pool mappings for active assignments, internal meetings, and new business initiatives. This includes competitive information, target company list development, and potential prospect identification.

The position sits with the recently established Borderless Team Hub (in Mexico City) and will work closely in a coordinated and integrated manner with the Practice team."
Associate Analyst - Talent Acquisition,Associate Analyst - Talent Acquisition,Nagarro,June,2024,"Company Description

We are a Digital Product Engineering company that is scaling in a big way! We build products, services, and experiences that inspire, excite, and delight. We work at scale — across all devices and digital mediums, and our people exist everywhere in the world (19000+ experts across 33 countries, to be exact). Our work culture is dynamic and non-hierarchical. We are looking for great new colleagues. That is where you come in!

Job Description

The ideal candidate will excel in talent acquisition, candidate experience, and building strong relationships.

Key Responsibilities:

Source, attract, and recruit top talent.
Review resumes, conduct screenings, and coordinate interviews.
Manage the interview process and communicate with candidates.
Maintain relationships with candidates, hiring managers, and partners.
Post job advertisements and ensure compliance with labor laws.
Provide regular recruitment reports and promote employer branding.

Qualifications

Bachelor's degree in HR, Business Administration, Psychology or related field.
2-3 years of recruitment experience.
Fluent in Spanish and English.
Proficiency in Microsoft Office and Applicant Tracking Systems (ATS).
Strong communication, organizational, and interpersonal skills.
Knowledge of local labor laws in Mexico.
Preferred Qualifications:
Experience recruiting across various industries.
Familiarity with modern recruitment tools.
Ability to work independently and in a team.
Proactive problem-solving skills."
Governance Analyst,Governance Analyst,ITJ,May,2024,"Governance Analyst.

In ITJ we're looking for Governance Analysts, responsible for supporting the ongoing development and evolution of our governance program to enable effective decision-making to reduce risks.

Essential Duties.
Assist with strategic planning in support of organizational objectives and key results.
Support a formal reporting program, to include metrics that track the maturity of the business.
Ensure consistent branding, messaging, and performance, while leveraging opportunities for collaboration and efficiencies through integrated processes and functions.
Support the maturation of the leadership steering committees and BISO program.
Ability to create executive-level presentations and reporting for various global audiences.
Work with the Governance Lead Analyst to prioritize initiatives to align with strategic goals.
Support the remediation of visibility and capability gaps and breakdown roadblocks standing in the way of a robust security posture.
Research and interpret industry insights and best practices, along with interpreting the impact of requirements from governing authorities.
Uphold company mission and values through accountability, innovation, integrity, quality, and teamwork.
Support and comply with the company’s Quality Management System policies and procedures.
Maintain regular and reliable attendance.
Ability to act with an inclusion mindset and model these behaviors for the organization.

Minimum Qualifications.
3+ years of work experience in information security, especially in governance, risk, and compliance. (GRC) role.
3+ years of experience writing and developing Information Security policies, procedures, guidelines, and metrics.
Experience with Security Awareness & Training tools.
Experience in reviewing processes and managing tools to proactively monitor and govern the effectiveness of controls and services.
Demonstrated experience in governance, risk, and compliance concepts.
Demonstrated experience with security risk management and compliance frameworks (e.g., NIST, ISO, HITRUST, HIPAA, PCI, GDPR).
Experience supporting governance programs in a globally regulated enterprise, with a significant cloud footprint a plus.
Experience developing metrics and reporting involving various areas and stakeholders.
Technically proficient in performing assigned duties at a high level of independence under minimal supervision while working within a team environment.
Excellent technical writing skills, communication skills, and appropriate adapting based on audience needs, through all mediums–verbal, written, presentation, and listening.
Able to be agile and work with ambiguity.
Relevant certification(s) in the field of risk, audit, or program/project management.
Proficient+ in Microsoft Office programs, such as PowerPoint, Excel, Outlook, and Word.
Demonstrated ability to perform the essential duties of the position with or without accommodation.

We offer the following benefits:
100% payroll scheme.
20 days - Christmas bonus.
12 days of vacation per year.
8% (cap) saving fund.
11% (cap) of food coupons.
Employer-paid medical and life insurance; medical insurance for employees.
Education reimbursement (Up to $54,000 per year).
30% vacation bonus.
10 days of paternity leave.
Work at Home Bonus for office equipment."
Analista de cultura y vida,Analista de cultura y vida,Concentrix,June,2024,"Analista de Cultura y Vida - MID
Promover la cultura organizacional por medio de la ejecución de las diferentes actividades de cultura y vida, logrando el desarrollo de la cultura Game Changer.
Actividades:
Ejecutar actividades del cronograma mensual, garantizando el cumplimiento de los proyectos establecidos por el área.
Mantener comunicación permanente con los Game Changers para facilitar el uso de los beneficios, programas o actividades disponibles.
Realizar reportes de gestión semanales, por medio de la verificación de los resultados y su alcance,
Orientar a los Game Changers en la utilización de recursos institucionales y externos, funcionamiento de convenios.
Requisitos
Lic en psicología, Administración de empresas o carrera a fin.
Experiencia de al menos 1 año en desarrollo organizacional.
Conocimientos de cultura y clima organizacional
Disponibilidad 100% on site
Manejo de Excel Básico
Actitud de servicio
Beneficios:
Oportunidades de crecimiento y desarrollo profesional
Excelente ambiente laboral
Beneficios adicionales a los de ley"
Analista de Acreditaciones Internacionales,Analista de Acreditaciones Internacionales,Universidad de Monterrey,May,2024,"En La Universidad De Monterrey, Fortalecemos Nuestra Misión Educativa Con Valores Católicos y Un Compromiso Inquebrantable Con La Excelencia Académica. Formamos Líderes Capaces De Impactar Positivamente En Una Sociedad Sostenible, Con Un Espíritu De Servicio Que Trasciende. En Este Contexto, Buscamos Un Profesional Excepcional Para Sumarse a Nuestro Equipo Como

Analista de Acreditaciones Internacionales

Objetivo del Puesto: Como Analista de Acreditaciones Internacionales, serás responsable del desarrollo y seguimiento de los procesos de acreditaciones por programa internacionales, así como los indicadores de mejora continua, con el fin de asegurar la alineación de los objetivos de la Dirección de Efectividad Académica.

Principales Responsabilidades

Asegurar los procesos para identificación, actualización, seguimiento y mantenimiento de las acreditaciones internacionales por programa académico.
Dar seguimiento a los procesos de acreditaciones por programa académico internacionales.
Asegurar el seguimiento al cumplimiento del calendario de procesos de acreditación.
Acompañar a los comités que elaboran los autoestudios con fines de acreditación.
Asegurar la recolección de evidencia generada por las áreas de apoyo de la UDEM hacia la academia.
Reportar las actualizaciones en el portal para informar a la comunidad UDEM.

Requisitos Académicos

Carrera de Ingeniería o Administración enfocada a calidad y/o procesos.
Dominio del idioma inglés (nivel conversacional).

Experiencia Requerida

Áreas de calidad y/o procesos.
En instituciones educativas.

Ofrecemos

Prestaciones de ley los primeros 3 meses y tarjeta de restaurante (Subsidiada al 80%).
Al obtener la planta (posterior a los 3 primeros meses) se agregan prestaciones superiores a las de Ley: Fondo de Ahorro, Vales de despensa, Aguinaldo de 45 días, Seguro de Gastos Médicos Mayores para el colaborador."
Analista Prevención Lavado de Dinero,Analista Prevención Lavado de Dinero,Seguros Monterrey New York Life,May,2024,"*Misión:
Coadyuvar al cumplimiento de las obligaciones y actividades del programa regulatorio de Prevención de Lavado de Dinero con el objetivo de cumplir con la normatividad aplicable y vigente respecto a esta materia.

*Funciones:
1. Elabora, analiza y documentar los casos de Riesgo Alto (RAC) derivados del análisis inicial de antecedentes del cliente, así como los casos con coincidencias con listas de alto Riesgo como OFAC, NON, ASE y la validación de países de riesgo, consultando herramientas internas (Tecnisys, Webflow) y externas (Finscan, Thompson, Quien es quien) que contienen las listas de alto riesgo que la compañía considera para llevar a cabo el análisis y evaluar el nivel de riesgo de los clientes con los que la compañía mantiene relación así como realizar las acciones de seguimiento definidas con base en el resultado.
2. Analiza y libera coincidencias de clientes con listas de riesgo (Personas Políticamente Expuesta de nacionalidad mexicana) que no cuentan con información suficiente para la identificación como apoyo para el área de operaciones, consultando la información y documentación que los clientes proporcionan y herramientas externas (Finscan, Thompson, Quien es quien) para confirmar o descartar las posibles coincidencias de casos sobre la identidad de personas políticamente expuestas de nacionalidad mexicana.
3. Elabora, analiza y documenta los casos relacionados con liberación de fondos y aplicación de depósitos de los clientes, relacionados con coincidencias en listas de riesgo, consultando la información y documentación que los clientes proporcionan y herramientas externas (Finscan, Thompson, Quien es quien) para verificar si es válida o no la entrega de los recursos así como la aplicación de fondos.
4. Ejecuta monitoreos sobre el cumplimiento de los diferentes procesos de la UPLD de acuerdo a los lineamientos establecidos, cómo validación de Contratos con Brokers, certificados de Grupo & Colectivo, pagos en efectivo y expedientes de clientes revisando la documentación de clientes y Brokers, validando que sea correcta con lo capturado en los sistemas internos para asegurar el correcto cumplimiento de los controles establecidos en el programa de prevención de lavado de dinero.
5. Realiza la carga de datos de identificación de los clientes que serán enviados al regulador (CNSF) por reportes de operaciones relevantes e inusuales en AML.net recabando la información en la documentación de los clientes auxiliándose de los sistemas internos (Webflow, Tecnisys) para asegurar el correcto cumplimiento del contenido de los reportes presentados al regulador con base en las obligaciones establecidas en las disposiciones de prevención de lavado de dinero, así como garantizar que el envío de estos se realice en el tiempo y forma establecido..
6. Asesora y auxilia a la fuerza de ventas, al departamento de Emisión y cambios Individual, Grupo & Colectivo y Selección de Riesgos en la aclaración de dudas acerca de la correcta identificación de las figuras a las que se refiere el artículo 492 de la Ley de Instituciones de Seguro y Fianzas (LISF), conociendo las Disposiciones de Carácter General del art. 492 y respondiendo de manera oportuna mediante los canales de apoyo como son correo electrónico, vía telefónica y/o capacitaciones presenciales para asegurar el cumplimiento de la regulación en los procesos de emisión y selección de la compañía con la finalidad de garantizar la adecuada identificación del cliente, así como evitar sanciones por omisiones y/o errores a causa del desconocimiento o la inadecuada interpretación de la normativa que nos rigen como compañía.

*Requerimientos
-Escolaridad: económico-administrativa (terminada o trunca)
-Conocimientos especiales y/o área de formación: Acerca de la regulación de prevención de lavado de dinero y experiencia en el sector financiero
-Inglés: básico
-Experiencia: 1 a 3 años en el sector financiero y de seguros"
Governance Analyst,Governance Analyst,Lear Corporation,May,2024,"Corporate Offices (Juarez, Chih., MX.)

As a Governance Analyst you will have the opportunity to coordinate, support, and monitor compliance efforts, and identify and implement best practices, conduct ongoing assessments of regulatory compliance performance, and eliminate any identified compliance gaps and provide support in compliance with all aspects related to government regulations.

YOUR TASKS WILL BE

Develop and provide training to employees on compliance policies, practices, and reporting systems.
Identify, investigate, and report compliance issues, irregularities, and violations.
Extract, process, and aggregate data, analyze these data groupings, and generate reports.
Problem-solving skills.
Quality management, project management, and business process analysis methods (focused on government regulations).

TO BE SUCCESSFUL IN THIS ROLE YOU WILL NEED

Bachelor’s Degree in Systems, Accounting or related.
Knowledge in the fiscal and customs area (labor and legal knowledge is a plus)
2-3 years of experience working in the relevant area of expertise.
English intermediate."
Cybersecurity Analyst II - PCI,Cybersecurity Analyst II - PCI,The Home Depot Global Technology Center In Mexico,June,2024,"In this role supporting the Secure Solution Advisors, you will have the opportunity to be a part and contribute to building the secure solution advisory program aligned to designated IT portfolios. The emphasis will be on providing excellent customer service and understanding business requirements. You will consult on key business initiatives ensuring comprehensive end-to-end risk identification and management. You will advise teams regarding remediation of vulnerability, configuration, and other security deficiencies. You will have the opportunity to coach customers to mature their understanding of security tools. This role requires cross-functional collaboration to identify trends, solve problems, ability to build relationships, influence without authority and drive outcomes across multiple stakeholder groups.
Preferred Qualifications:
least 2-3 years in an analyst role within cybersecurity or as an engineer on an IT team with a security focus
to provide clear oral and written communication to a variety of business and technical audiences.
resolution of cyber findings and PCI vulnerabilities.
with our advisory program aligned with designated IT portfolios.
on key business initiatives.
large datasets and provide risk metrics/themes through dashboards or presentations.
related certifications like CompTIA+, CISSP, etc., an added plus"
ANALISTA SQE,ANALISTA SQE,Coca-Cola FEMSA,May,2024,"Somos Coca-Cola FEMSA (KOF), el embotellador y comercializador más grande del mundo por volumen del sistema Coca-Cola. Diariamente servimos a más de 381 millones de personas en Latinoamérica. Nuestros más de 80 mil colaboradores nos permiten representar a más de 169 marcas líderes en los diferentes territorios donde tenemos presencia. En Coca-Cola FEMSA, cada día es una oportunidad para aprender y crecer. ¿Te gustaría ser parte de nuestro equipo?

PRINCIPALES ACTIVIDADES

Participa en la administración, implantación y mejoramiento de los procesos y procedimientos que competen al área de Aseguramiento de la Calidad.
Participar cuando sea requerido, en acciones preventivas, correctivas y de mejora que sean implementadas en su área de trabajo.
Estricto apego a lineamientos de control interno.
Actividades de Validación/Verificación de procesos tales como: Tratamiento de Aguas, Jarabes, clarificado, procesos de saneamiento, líneas de producción (según aplique).
Pertenecer al equipo FSSC 22000 vigente e ISO’S Centralizadas.
Participar en actividades del programa de evaluación sensorial, para asegurar que las materias primas, producto intermedio y producto terminado, cumplan con los parámetros sensoriales y normas establecidas.
Operación de equipos de procesos (cuando aplique).
Realizar las actividades que indique la norma técnica de competencia laboral, cuando aplique.


Participar, Desarrollar y Ejecutar acciones que contribuyan y aseguren el cumplimiento con las normas ISO 9001:vigente, ISO 14001:vigente, ISO 45001 vigente, FSSC 22000: vigente y las normas que apliquen para la mejora de los sistemas.

Si cumples con los requisitos de puesto y tu objetivo es aprender, crecer y desarrollar una carrera plena de desafíos, te invitamos a enviarnos tu postulación. En Coca-Cola FEMSA consideramos firmemente que el Talento es la clave para el éxito. Es por ello que estamos comprometidos en ofrecer las mismas oportunidades de desarrollo para todos los candidatos sin diferenciación de origen, raza, estado civil, edad, opinión política, género, credo, asociación a una cultura o afiliación a un sindicato, clase social o económica, situación familiar, embarazo, lengua, orientación sexual, identidad de género, discapacidad, enfermedad, nacionalidad o estatus migratorio y/o cualquier otro motivo. Valoramos la diversidad, ya que sabemos que nos hace más fuertes. En FEMSA, Coca-Cola FEMSA, OXXO, FEMSA Empaque y FEMSA Logística, TODOS los procesos de reclutamiento y selección de personal son GRATUITOS para todos los postulantes."
Metadata Analyst,Metadata Analyst,Sony Music Entertainment,September,2023,"Job Summary:

The Metadata DQC Analyst, Central Repertoire and Metadata Group will report directly to Senior Metadata Analyst of Central Repertoire and Metadata Group.

The Metadata DQC Analyst, Central Repertoire and Metadata Group, responsibilities may include, but will not be limited to:

Support SME Labels and Affiliates in creating, maintaining and policing ""Best in Class"" Metadata
Review, improve, and distribute existing system and ad-hoc reports to support high data quality
Analyze new metadata concerns and collaborate with IT groups to establish new DQC reports
Oversee progress in resolution of known issues with colleagues within CRG and escalate to management when assistance for closure is needed
Coordinate with Sales Processing groups and other Sony departments to ensure timely closure of metadata errors
Coordination and oversight of off-site outsourced staff (WNS)
Assist in the creation and coordination of regular and ad-hoc management reports
Address special projects as they arise and assess underlying needs
Provide professional support for client's corporate metadata environment, specifically around iTunes
Utilize Business Production Outsourcing to monitor worldwide metadata for Sony Affiliates and Labels to ensure iTunes style guidelines are being followed to comply with iTunes Requirements

Job Specific Competencies:

Ability to work independently on multiple projects a must
Ability to ensure deadlines are met or utilize management assistance
Ability to conceptualize and formalize business and technical requirements
Ability to work with a diverse group of people
Ability to handle multiple reporting structures
Ability to work proficiently with Microsoft Office ( Excel, Outlook, etc)"
