Position,Company_Name,Location,Post_Month,Post_Year,Details
Change Management Lead,Change Management Lead,Reuters News Agency,December,2023,"Job Description

Change Management Lead

Are you passionate about the chance to bring your experience to a world-class company that is market- leading for both content and technology? If yes, we are looking for you.

Join our team! The Change Management Lead is accountable for preparing employees and customers to adopt the changes in tools, business processes, and job roles as part of TR’s Commercial Systems Program. This program introduces significant change for employees in the form of simplified business processes & standard toolsets, as well as changes for customers in the form of digital self-serve tools, standardized commercial policies, and optimization of existing experiences. The Change Management Lead prepares employees and customers to quickly adopt changes so the benefits of these investments can be fully realized.

About The Role

In this opportunity as Change Management Lead, you will:

Apply a structured process to produce change artifacts that contribute to a cohesive & holistic strategy for the Commercial Systems Program; these change artifacts will help employees in all affected roles engage, adopt, and use changes effectively in their day-to-day work.
Be focused on the people side of change, including changes to business processes, systems, and technology as well as job roles and organization structures. The primary function of the role is to create and implement change strategies and plans that maximize stakeholder adoption and minimize resistance, driving adoption and proficiency of the change within the organization.
Lead organizational change management activities for small to medium-sized initiatives and/or participate on a change team on one or multiple initiatives of varying complexity using a structured change management methodology.
Build change management approach and plans integrating change management activities into the overall transformation project plan leveraging industry standard methodology to ensure successful planning and delivery
Create engagement strategy and plans in partnership with key functions including project management, communications, human resources, leadership and managers for impacted stakeholders to drive buy-in and adoption of the change
Develop or support communication plans, key messages, presentations and write communications for all levels of the organization
Support training where needed including training assessments and design/development of training materials
Develop a sponsor roadmap for senior leaders to fulfill the role of change sponsor
Provide direct support and coach front-line managers and supervisors as they help their direct reports through transitions
Lead or support change management activities with cross-functional team members and stakeholders to understand, manage, and reinforce change throughout the transformation life-cycle using key methods and tools including Stakeholder analysis and management plans. Change impact assessments. Change readiness and resistance plans. Change adoption and action plans. Define and measure success metrics and monitor change progress and adoption.
Work with and influence individuals at all levels of the organization to drive change; support and engage senior leaders, coach managers, supervisors and project teams, evaluate and ensure stakeholder readiness and adoption
Measure and monitor progress at clearly defined points in the process to ensure change activities are aligned with transformation objectives, delivered on time, and meet or exceed expectations
Support organizational effectiveness efforts including org design and definition of roles and responsibilities
Maintain a solid understanding of organizational change management, incorporating best practices as they emerge

About You

You're a fit for the role if your background includes:

Fluency in English Is Required
Bachelor’s degree in Business Management, related field, or equivalent experience is required.
4+ years experience implementing complex, cross-functional initiatives required with a solid understanding of how people react to change and the change process; experience leading change management specific activities preferred
Ability to match working hours of US-based stakeholders
Strong leadership/influencing/relationship management skills; ability to understand and align interests across the enterprise and drive collaboration among groups
Strong communication skills – both written and verbal:
Excellent active listening skills
Experience writing clear, effective communications to a variety of audiences
Experience presenting to stakeholders, using verbal and written communications
Ability to influence others and move toward a common vision or goal
Demonstrated conflict resolution, negotiating and influencing skills
Flexible and adaptable; able to work in ambiguous situations where the organization is in continuous change
Experience indirectly managing cross-functional team members and stakeholders in activities that result in the adoption of change
Ability to manage and prioritize multiple activities in a dynamic environment; multitasking and organizational skills
Experience in initiatives that include off-shoring, on-shoring, out-sourcing, and in-sourcing highly desirable
Experience applying change management principles, methodologies, and tools to transformations, a plus
Prosci change management certification or a similar change management designation, highly desirable
Organized with a natural inclination for planning and tactics; self‐directed and proactive
Acute business acumen and understanding of organizational issues and challenges
Resilient and tenacious with a propensity to persevere
Must be a team player, able to effectively and collaboratively work with and through others, at all levels in the organization
Strong analytical & problem solving skills
Strong learning aptitude and agility
Location: CDMX

What’s in it For You?

You will join our inclusive culture of world-class talent, where we are committed to your personal and professional growth through:

Hybrid Work Model: We’ve adopted a flexible hybrid working environment for our office-based roles while delivering a seamless experience that is digitally and physically connected.
Culture: Globally recognized and award-winning reputation for equality, diversity and inclusion, flexibility, work-life balance, and more
Wellbeing: Comprehensive benefit plans; flexible and supportive benefits for work-life balance: company-wide Mental Health Day Off; Headspace app subscription; retirement, savings, tuition reimbursement, and employee incentive programs; resources for mental, physical, and financial wellbeing
Learning & Development: LinkedIn Learning access; internal Talent Marketplace with opportunities to work on projects cross-company; Ten Thousand Coffees Thomson Reuters café networking
Social Impact: Eight employee-driven Business Resource Groups; two paid volunteer days annually; Environmental, Social and Governance (ESG) initiatives for local and global impact
Purpose Driven Work: We have a superpower that we’ve never talked about with as much pride as we should – we are one of the only companies on the planet that helps its customers pursue justice, truth and transparency. Together, with the professionals and institutions we serve, we help uphold the rule of law, turn the wheels of commerce, catch bad actors, report the facts, and provide trusted, unbiased information to people all over the world.

What's in it For You?

You will join our inclusive culture of world-class talent, where we are committed to your personal and professional growth through:

Hybrid Work Model: We’ve adopted a flexible hybrid working environment (2-3 days a week in the office depending on the role) for our office-based roles while delivering a seamless experience that is digitally and physically connected
Wellbeing: Comprehensive benefit plans; flexible and supportive benefits for work-life balance: flexible vacation, two company-wide Mental Health Days Off; work from another location for up to a total of 8 weeks in a year, 4 of those weeks can be out of the country and the remaining in the country, Headspace app subscription; retirement, and employee incentive programs; resources for mental, physical, and financial wellbeing.
Culture: Globally recognized and award-winning reputation for equality, diversity and inclusion, flexibility, work-life balance, and more.
Learning & Development: LinkedIn Learning access; internal Talent Marketplace with opportunities to work on projects cross-company; Ten Thousand Coffees Thomson Reuters café networking.
Social Impact: Ten employee-driven Business Resource Groups; two paid volunteer days annually; Environmental, Social, and Governance (ESG) initiatives for local and global impact.
Purpose-Driven Work: We have a superpower that we’ve never talked about with as much pride as we should – we are one of the only companies on the planet that helps its customers pursue justice, truth, and transparency. Together, with the professionals and institutions we serve, we help uphold the rule of law, turn the wheels of commerce, catch bad actors, report the facts, and provide trusted, unbiased information to people all over the world.

Do you want to be part of a team helping re-invent the way knowledge professionals work? How about a team that works every day to create a more transparent, just and inclusive future? At Thomson Reuters, we’ve been doing just that for almost 160 years. Our industry-leading products and services include highly specialized information-enabled software and tools for legal, tax, accounting and compliance professionals combined with the world’s most global news services – Reuters. We help these professionals do their jobs better, creating more time for them to focus on the things that matter most: advising, advocating, negotiating, governing and informing.

We are powered by the talents of 26,000 employees across more than 70 countries, where everyone has a chance to contribute and grow professionally in flexible work environments that celebrate diversity and inclusion. At a time when objectivity, accuracy, fairness and transparency are under attack, we consider it our duty to pursue them. Sound exciting? Join us and help shape the industries that move society forward.

Accessibility

As a global business, we rely on diversity of culture and thought to deliver on our goals. To ensure we can do that, we seek talented, qualified employees in all our operations around the world regardless of race, color, sex/gender, including pregnancy, gender identity and expression, national origin, religion, sexual orientation, disability, age, marital status, citizen status, veteran status, or any other protected classification under applicable law. Thomson Reuters is proud to be an Equal Employment Opportunity/Affirmative Action Employer providing a drug-free workplace.

We also make reasonable accommodations for qualified individuals with disabilities and for sincerely held religious beliefs in accordance with applicable law.

Protect yourself from fraudulent job postings click here to know more.

More information about Thomson Reuters can be found on https://thomsonreuters.com."
Change Management Senior Consultant,Change Management Senior Consultant,Deloitte,May,2024,"Bring your career into focus at Deloitte Americas Regional Delivery Center, we know that great people make great organizations.
Deloitte invests in outstanding people of diverse talents and backgrounds and empowers them to achieve more than they could elsewhere. Our work combines advice with action and integrity. We offer the opportunity to sharpen your skills in addition to hands-on experience in the global, fast-changing technology business field.

Today you can be part of it in our offices in Queretaro, México. At Deloitte you'll be able to:

Work side by side with the best professionals, learning from your teammates and reaching success all as one team.
Get to know and work side by side with the most important companies globally while helping them to reach their business goals.
You will have countless learning opportunities and development, which will help you define the direction in which you want to take your career.

Soft Skills:
Ability to exercise initiative, work independently, prioritize tasks, and work as a team member.
Ability to, and experience managing multiple priorities and deliver commitments on time
Ability to work collaboratively on projects.
Creative problem solver.
Strong people skills.
Excellent oral and written communication skills.
Excellent presentation Skills
Comfort combining both qualitative and quantitative analysis to solve business problems
Strong business acumen, with ability to quickly translate theoretical concepts into practical outcomes that deliver business value.

Technical Skills:
Change Management Methodologies
ACMP, PROSCI, AKDAR, HCMBOK desirable
Change Management Communications
Change Impact Assessments, change readiness assessment, Stakeholder Analysis, Change Canvas and Change Management Strategy
Adobe Creative Suite
MS Teams, Strong Microsoft Office skills (PowerPoint and Excel)
Desired: Design Thinking, Operating Model

Qualifications
Required:
5+ Years in Organizational Change Management
Proven experience in change management (stakeholder analysis, communication plan, change impact assessment, and change readiness assessment) for organizational transformations driven by technology such as ERPs, SAP, Oracle or similar.
Consultancy experience preferred.
Advanced English level

Every day your work will make an impact that matters. You will thrive in a dynamic culture of high performance, inclusion, flexibility, and build lifelong relationships within a powerful global network.

Possibility awaits, changes are inevitable and together we can make the difference. Apply now!

Deloitte refers to one or more of Deloitte Touche Tohmatsu Limited, a UK private company limited by guarantee (“DTTL”), its network of member firms, and their related entities. DTTL and each of its member firms are legally separate and independent entities. DTTL (also referred to as “Deloitte Global”) does not provide services to clients. Please see www.deloitte.com/about for a more detailed description of DTTL and its member firms.
© 2022. For information, contact Deloitte Touche Tohmatsu Limited.


#LI-DT3"
Change Management and Market Development Manager,Change Management and Market Development Manager,myGwork - LGBTQ+ Business Community,June,2024,"This inclusive employer is a member of myGwork – the largest global platform for the LGBTQ+ business community.

Job Description

We are seeking a skilled and motivated individual to join our team as a Change Management and Marketing Manager. In this role, you will be responsible for overseeing change management and marketing activities for the Fisher Scientific eCommerce site, as well as managing eProcurement marketing needs across thermofisher.com and fishersci.com. Your primary goal will be to ensure a seamless customer experience, optimize user adoption, and drive business growth through effective change management strategies and targeted marketing efforts.

Responsibilities

Develop and implement change management strategies to support the successful rollout of updates, enhancements, and new features on the Fisher Scientific eCommerce site.
Collaborate with cross-functional teams, including product, marketing, and sales, to ensure alignment and effective execution of change management initiatives.
Conduct impact assessments and stakeholder analyses to identify potential risks and develop mitigation plans.
Create and deliver training materials, workshops, and presentations to educate internal stakeholders and customers on changes and improvements to the eCommerce platform.
Monitor and analyze user feedback, behavior, and adoption metrics to identify areas for improvement and optimize the user experience.
Develop and execute communication strategies, including email campaigns, website announcements, emails, and social media posts, to inform users about website updates and enhancements
Drive content updates for website enhancements, ensuring that all changes are effectively updated within website content, and communicated to internal stakeholders and customers
Collaborate with marketing teams to develop and execute marketing campaigns and initiatives to drive customer engagement, adoption, and overall customer experience.
Collaborate with the eProcurement team to ensure seamless integration and functionality between thermofisher.com, fishersci.com, and other eProcurement platforms.
Utilize data-driven insights to develop targeted change management and marketing strategies and be able to pivot and optimize strategies when needed.

Qualifications

Bachelor's degree in marketing, business, or a related field. Master's degree is a bonus
Proven experience in change management, downstream marketing, supporting digital platforms.
Strong project management skills with the ability to prioritize and manage multiple initiatives simultaneously.
Excellent communication and presentation skills, with the ability to effectively convey information to both technical and non-technical audiences.
Analytical mindset with the ability to interpret data and make data-driven decisions.
Experience with eProcurement platforms is a plus.
Strong problem-solving skills and ability to adapt to changing business needs.
Ability to work collaboratively in a cross-functional team environment.
If you are a highly motivated individual with a passion for change management, marketing, and eCommerce, and possess the necessary skills and qualifications, we invite you to apply for this exciting opportunity. Join our team and contribute to driving the success of Thermo Fisher Scientific."
LATAM Project Management Office Sr. Manager,LATAM Project Management Office Sr. Manager,Newell Brands,May,2024,"Position Title: Program Manager Office (PMO) LATAM Lead
Location: Mexico City


The Program Management Office LATAM (PMO) will be responsible for leading our strategic initiatives and priorities implementation across the LATAM region. This role requires an expert in Lean Tools and Agile methodologies, with a proven track record in leading and influencing multifunctional teams and projects. The role operates as a Center of Excellence for Program Management and sits inside of our Regional Leadership Team. It collaborates directly with senior leaders in the region on commercial and back office functions, and has responsibility for key projects across the region. The main goal of the PMO is to provide quality project management services and build project management capabilities across the region using world-class standards, guidelines, processes, tools, agile methodology and techniques.

Specific Responsibilities

Lead and oversees priority projects which require high levels of functional integration detailed process mapping and tracking
Demonstrate strong capabilities in all program management competencies, including planning, executing, monitoring, and controlling of strategic and complex technical projects.
Manage projects from initial concept through final implementation utilizing effective management and tracking tools.
Responsible to help define and deliver project scope and manage a decentralized project team. Must partner effectively with multiple functional and segments leaders to identify and mitigate risks to timeline and cost.
Responsible for ensuring all project requirements are properly identified and translated to project documentation to define the scope.
Create and review project plans, work with stakeholders to understand complex problems, propose resolution, remove roadblock in a timely manner and escalate when necessary to meet timelines.
Drive the adoption to PMO management standards and practices to conduct consistently, efficiently, and timely the projects execution.
Drives team accountability and ownership on execution to deliver project on timing, cost, quality, and budget.
Monitor and report status of project progress and risks to the project sponsor, leadership team and key stakeholders.
Hold regular reviews with peer managers to ensure program and project plans are aligned with major initiative among teams in the region as assigned.
Use financial information and data to conduct analysis and support fact-based project and business decisions.
Identify project management gaps and develop, improve, and implement standards, guidelines, practices, processes, and templates for managing projects consistently and efficiently in order to achieve results on time while reduce project related risk and costs.
Provide support and guidance to Project Leaders and Managers as needed with oversight on their project progress and development, while forming strong partnerships with cross-functional teams.
Mentor and coach Project Leaders and Managers to drive their performance on plans implementations.
Leads collaboration efforts across the organization to leverage best practices, expertise, and shared resources.
Provide coaching and training to functional project leaders to build on country/Cluster project management capabilities across Newell LATAM.

The Candidate

The Program Management Office LATAM Lead will have responsibility to deliver solutions for the strategic initiatives in LATAM, which is a vertically integrated operation inside global Newell business. This requires excellence in strategic planning, tactical leadership and execution across all geographies and functions, including Agile & Lean methodology for Sales, Marketing, E-Comm, Sales Operations, Finance, etc.
The candidate must be technically competent with a willingness to be hands-on and comfortable with tactical execution while working on projects of strategic importance.

Key Responsibilities

Strategic Leadership: Lead and follow up on our initiatives and strategic priorities, ensuring alignment with overall business objectives.
Project Management: Expertise in valuating projects, implementing tracking solutions, and ensuring projects advance on time.
Team Leadership: Proven experience in leading multifunctional teams, fostering a collaborative and inclusive work environment.
Agile Expertise: Lead Agile Sprints and projects, leveraging expertise as a Scrum Master.
Analytics: Utilize analytics skills and project management tools to drive decision-making and project execution.

Qualifications

Bachelor’s degree in Industrial Management, Engineering, Business Management, or related technical field, PMP Certification preferred.
10+ years of leadership experience preferred in project management for Supply Chain on CGP industries.
Demonstrated familiarity with commercial & strategic projects implementation.
Experience leading complex programs with high complexity and high levels of capital spend or aggressive business goals expectation in short term periods.
Proven ability to facilitate relations between Executive Leadership, Sales, Marketing & Comemrcial teams, along with business and segments functions at a Regional & Global Level.
Ability to interact and communicate appropriately with cross-functional personnel through executive leadership.
Demonstrated track record of effectively building partnerships to manage and resolve challenges.
Demonstrated familiarity with structured project management methodologies.
Demonstrated knowledge and experience managing technical and business requirements to deliver integrated solutions.
Experience in developing and deploying project management best practices, policies, procedures, and processes.
Logical and creative problem-solving and analytical skills required.
Proficient in project management tools such as Microsoft office suite, Microsoft Project, Smartsheet, PowerBI and SharePoint.
Possesses influencing skills (leads by example, clearly articulates business cases and interpretation of cause-effect impact).
Demonstrates high ethics and values.
Highly effective organization and planning skills.
Ability to thrive in a fast-paced, dynamic environment.

Required Skills and Experience

Lean Tools: Expertise in Lean Tools to drive efficiency and effectiveness in processes.
Agile Methodology: Proficiency in Agile methodology, with experience as a Scrum Master.
Leadership: Strong leadership and influencing skills, with the ability to navigate complex organizational structures.
Analytics: Strong analytical skills, with the ability to derive insights from data to inform decision-making.
Project Management Tools: Proficiency in using project management tools to track and manage projects.
Experience: Proven experience in leading teams and managing large-scale projects.

Preferred Qualifications:

Consumer products industry experience.
Comfortable working with diverse and distributed teams.
Excellent written and verbal communication skills and presentation skills.
MBA or advance Degree in Business, Management, or related field.
Bilingual English / Spanish
Ideally proficient in Portuguese



High level of organization, discipline, logical, priority and maintenance in the region. Identify prioritires, execute and maintain pla, approach, tracking , dashboard, structure, full time job keeping the team on track. Self confident. Acknowlege deficiencies, conflict management. Some understanding of our business, our type of industry, consumer package goods. Matrix driven organizations. Cross functional partners. Follow up process connectin business and tasks. Push the right buttons in time. Realy hands on. Not so senior they don’t involve in operation."
