job_id,employer_name,employer_logo,employer_website,employer_company_type,job_publisher,job_employment_type,job_title,job_apply_link,job_apply_is_direct,job_apply_quality_score,apply_options,job_description,job_is_remote,job_posted_at_timestamp,job_posted_at_datetime_utc,job_city,job_state,job_country,job_latitude,job_longitude,job_benefits,job_google_link,job_offer_expiration_datetime_utc,job_offer_expiration_timestamp,job_required_experience,job_required_skills,job_required_education,job_experience_in_place_of_education,job_min_salary,job_max_salary,job_salary_currency,job_salary_period,job_highlights,job_job_title,job_posting_language,job_onet_soc,job_onet_job_zone,job_occupational_categories,job_naics_code,job_naics_name
UbUS_R0WEiklkxDaAAAAAA==,Cognizant Technology Solutions,https://news.cognizant.com/images/COG-Logo.svg,http://www.cognizant.com,Computer Services,Cognizant,FULLTIME,Solution Architect,https://careers.cognizant.com/global/en/job/00058252971/Solution-Architect,False,0.8925,"[{'publisher': 'Cognizant', 'apply_link': 'https://careers.cognizant.com/global/en/job/00058252971/Solution-Architect', 'is_direct': False}, {'publisher': 'Cognizant Careers', 'apply_link': 'https://careers.cognizant.com.en2hi.search.translate.goog/professionals/mx/es/job/00058252971/Solution-Architect', 'is_direct': False}, {'publisher': 'OCCMundial', 'apply_link': 'https://www.occ.com.mx/empleo/oferta/18311390-solution-architect/', 'is_direct': False}, {'publisher': 'Adzuna', 'apply_link': 'https://www.adzuna.com.mx/details/4622324184', 'is_direct': False}, {'publisher': 'BeBee México', 'apply_link': 'https://mx.bebee.com/job/0a3a8e75fc3b8d82db18a734a7212c7a', 'is_direct': False}, {'publisher': 'Talentify', 'apply_link': 'https://www.talentify.io/job/solution-architect-job-number-00058252971-cuauhtemoc-mexico-city-cognizant-2228116', 'is_direct': False}, {'publisher': 'Expertini', 'apply_link': 'https://mx.expertini.com/jobs/job/solution-architect-mexico-city-cognizant-51ad40869c/', 'is_direct': False}, {'publisher': 'Trabajo.org - Vacantes De Empleo, Trabajo', 'apply_link': 'https://mx.trabajo.org/oferta-867-c2a01e6b3ce4a6a3dc60143025c2e6db', 'is_direct': False}]","We’re hiring!

At Cognizant we have an ideal opportunity for you to be part of one of the largest companies in the digital sector worldwide. A Great Place To Work where we look for people who contribute new ideas, experiencing a dynamic and growing environment. At Cognizant we promote an inclusive culture, where we value different perspectives providing career growth and development opportunities. #WelcomeToCognizant!

We have an exciting opportunity for an exceptional individual to work supporting one of our clients as a Solution Architect

Description:
The solution architect is responsible for driving security engineering within large programs collaborating with a cross functional team to achieve clear security engineering objectives including but not limited to:
Partner with product teams to roadmap and plan security backlog items.
Refine security requirements into engineering patterns to drive security and privacy by design
Consider assurance solutions within CI/CD pipelines.
Provide direction on cloud platform and workload security engineering for Azure and OCI.
Provide security architecture and engineering guidance for SaaS cloud platforms.
Be a transformation agent in adopting modern security engineering practices.
Bring a software engineering mindset to security engineering and promote everything as code.

Skills
• Strong understanding of cloud security platform architecture (Azure/OCI) at tenant and workload level.
• Experience building assurance processes within CI/CD pipelines.
• Strong understanding of current cyber threats, mitigation and enterprise challenges.
• ADVANCED ENGLISH IS A MUST
• This position is to work in a hybrid mode in CDMX, Guadalajara OR Monterrey

Why Cognizant?

Improve your career in one of the largest and fastest growing IT services providers worldwide

Receive ongoing support and funding with training and development plans

Have a highly competitive benefits and salary package

Get the opportunity to work for leading global companies

We are committed to respecting human rights and build a better future by helping your minds and the environment

We invest in people and their wellbeing.

We create conditions for everyone to thrive. We do not discriminate based on race, religion, color, sex, age, disability, nationality, sexual orientation, gender identity or expression, or for any other reason covered.

At Cognizant we believe than our culture make us stronger!

Join us now!",False,1712102400,2024-04-03T00:00:00.000Z,Ciudad de México,CDMX,MX,19.432608,-99.13321,,https://www.google.com/search?gl=us&hl=en&rciv=jb&q=software+infrastructure+architectin+mexico&start=0&ibp=htl;jobs#fpstate=tldetail&htivrt=jobs&htiq=software+infrastructure+architectin+mexico&htidocid=UbUS_R0WEiklkxDaAAAAAA%3D%3D,,,"{'no_experience_required': False, 'required_experience_in_months': None, 'experience_mentioned': True, 'experience_preferred': False}",,"{'postgraduate_degree': False, 'professional_certification': False, 'high_school': False, 'associates_degree': False, 'bachelors_degree': False, 'degree_mentioned': False, 'degree_preferred': False, 'professional_certification_mentioned': False}",False,,,,,{},Solution architect,en,15119900,4,['IT Infrastructure'],541511,Custom Computer Programming Services
7Oa1--CRYyeQEqTcAAAAAA==,Siemens,https://upload.wikimedia.org/wikipedia/commons/thumb/3/3c/Siemens_AG_logo.svg/2560px-Siemens_AG_logo.svg.png,http://www.siemens.com,Manufacturing,Talentify,FULLTIME,Infrastructure Architect - Cloud,https://www.talentify.io/job/infrastructure-architect-cloud-mexico-city-mexico-city-siemens-359993,False,0.5032,"[{'publisher': 'Talentify', 'apply_link': 'https://www.talentify.io/job/infrastructure-architect-cloud-mexico-city-mexico-city-siemens-359993', 'is_direct': False}]","Positions Overview: Act as part of a Professional Services team, work productively with Consultants, Architects, Project Managers, and other internal & external interfaces to ensure that the customer succeeds in their objectives. As an Infrastructure Architect resource, responsible for the translation of business requirements into specific process aligned infrastructure designs for the Siemens DI Software solution based best practices in the subject area, in order for the Siemens DI Software solution to deliver market leading solutions and provide value to the customer. In line with project processes and messaging, interact with the customer to support the management of customer expectations and support customer adoption by leveraging the complete Siemens Delivery framework. Act as infrastructure consultant to strategic Sales/PreSales pursuits and Services projects, providing guidance through the complexity of Infrastructure architecture options and the long-term roadmap for the solution. Act as the authority on infrastructure architectural design to address business problems. Provides direction for infrastructure design, sizing, security recommendations, database, Operating system, and network recommendations, system monitoring, and performance optimization internally or at customer sites. Consults on strategic and/or complex Enterprise projects at country level, of diverse scope that require specialist expertise and high levels of technical leadership. Works under self management within project and/ or task constraints and will determine solutions, methods and procedures on assignments/projects. Leverage relevant templates in the deployment of project solutions in own specialist area, and contribute to best practices and templates. Responsibilities: Customer Engagement & Relationship Management: Establish, build and maintain effective relationships with internal or external customers technical peers and build new relationships through networking within the customer and other involved parties to support effective delivery Set and manage stakeholders' expectations, demonstrating thought leadership to effectively influence key contacts and recommend solutions. In conjunction with the senior project leadership and account team, apply stakeholder management methods to support successful adoption of a viable DI solution Provide information and feedback to internal or external customers in a timely, accurate and appropriate manner, as required by defined project activities, ensuring that key messages are communicated effectively Be able to communicate effectively up to CxO level and to build understanding of the DI solution for the customer, its drivers, value and impact in order to position and sell the strategic vision and identify future opportunities for solution expansion. Project Delivery: Understand the context of the customer project, its contract type, key deliverables and the engagement model. Lead the application of Solution Definition, Systems Architecture, and Solution Enablement elements DI Deployment Framework on project Understand the purpose of the project, its work breakdown and its relationship to the overall internal or external customers solution Contribute to estimation of time frames, workpackage breakdown, capability definitions and quantity of resources estimates required to successfully implement the project Provide accurate and timely information to project management team, reporting project status, issues, risks and benefits. Contribute to the generation of relevant level of project support documentation in line with Siemens or customer Project Management Methodology as required Maintain project documentation for required standards, processes, and policies related to infrastructure solution delivery Contribute to quality and phase gate reviews as required. Contribute to the review of technical implementation experiences with project delivery team, capturing and sharing lessons learnt as part of the project review and close activities Effectively apply project change management rules to the project Work closely with project management to ensure architectural alignment with project goals and requirements and ensure deliveries progress alignment with plans. Keep service managers aware of key customer infrastructure issues, identifying and resolving potential problems and conflicts. Work with the appropriate Security compliance officers to ensure the regulations, policies, procedures and controls are followed per the in-country laws for the cloud service offerings. Solution Delivery: Use the SDI Delivery Framework with corresponding templates and propagate them throughout the project team to optimize project execution Ensure the conceptual completeness of the technical solution. Support “User Acceptance Testing activity” in order to confirm relevant non-functional requirements have been met with the final solution and close requirements traceability. Execute Deployment readiness review to ensure all infrastructure items are completed and setting properly configured. Support the deployment of high risk multi-domain infrastructure solutions for strategic or highly complex customer solutions Collaborate with Product Development and Testing teams to work on typical Performance and Security compliance use cases as applicable to various Customers Infrastructure/Performance Coordinate architecture implementation and modification activities Implement system monitoring solutions into customer environments Provide advice and strategies for appropriate go live and post production adoption activities utilizing SDI Best Practices and supported by OCM principles for system monitoring and baseline testing Assist in post-implementation continuous-improvement efforts to enhance performance and provide increased functionality. Qualifications: 8-10 years experience,supporting a customer Production instance Strong hands-on AWS setup and administrations skills are mandatory (EC2, VPC, Load balancers, VPN , RDS , S3 , Lambda knowledge is must) Linux / Windows system administration knowledge is must. RHCE certified recommended. Active directory/LDAP & SSO administration. Understanding of Cloud VPN knowledge is must Automation tools knowledge like Terraform, Ansible preferred. Scripting knowledge is preferred as well. At Siemens we are always challenging ourselves to build a better future. We need the most innovative and diverse Digital Minds to develop tomorrow’s reality. Find out more about the Digital world of Siemens here: [1] www.siemens.com/careers/digitalminds #LI-PLM #LI-AL1 #DISW #LI-HYBRID Organization: Digital Industries Company: Siemens Industry Software, S.A. de C.V. Experience Level: Experienced Professional Full / Part time: Full-time",False,1678320000,2023-03-09T00:00:00.000Z,Ciudad de México,CDMX,MX,19.432608,-99.13321,,https://www.google.com/search?gl=us&hl=en&rciv=jb&q=software+infrastructure+architectin+mexico&start=0&ibp=htl;jobs#fpstate=tldetail&htivrt=jobs&htiq=software+infrastructure+architectin+mexico&htidocid=7Oa1--CRYyeQEqTcAAAAAA%3D%3D,,,"{'no_experience_required': False, 'required_experience_in_months': 96, 'experience_mentioned': True, 'experience_preferred': True}",,"{'postgraduate_degree': False, 'professional_certification': False, 'high_school': False, 'associates_degree': False, 'bachelors_degree': False, 'degree_mentioned': False, 'degree_preferred': False, 'professional_certification_mentioned': True}",False,,,,,{},Infrastructure architect,en,15119900,4,,33429,Other Communications Equipment Manufacturing
-zw2wyek8u6B3YbsAAAAAA==,ABB,https://upload.wikimedia.org/wikipedia/commons/thumb/0/00/ABB_logo.svg/2560px-ABB_logo.svg.png,http://www.abb.com,Manufacturing,ABB Career,FULLTIME,IT Infrastructure Solution Architect,https://careers.abb/czech/cs/job/91177426/IT-Infrastructure-Solution-Architect,False,0.8168,"[{'publisher': 'ABB Career', 'apply_link': 'https://careers.abb/czech/cs/job/91177426/IT-Infrastructure-Solution-Architect', 'is_direct': False}, {'publisher': 'Indeed', 'apply_link': 'https://mx.indeed.com/viewjob?jk=91f8f52a4110269b', 'is_direct': False}, {'publisher': 'OCCMundial', 'apply_link': 'https://www.occ.com.mx/empleo/oferta/18310023-it-infrastructure-solution-architect/', 'is_direct': False}, {'publisher': 'XING', 'apply_link': 'https://www.xing.com/jobs/san-luis-potosi-infrastructure-solution-architect-118172963', 'is_direct': False}, {'publisher': 'BeBee México', 'apply_link': 'https://mx.bebee.com/job/f24b9123a036088a12019d69bd7a965f', 'is_direct': False}, {'publisher': 'SimplyHired', 'apply_link': 'https://www.simplyhired.mx/job/tt9m-m3oDxUuTwKM2dw748X9Jr2SssxMCa8JhhD2zLrIWFLKbtREBw', 'is_direct': False}, {'publisher': 'Trabajo En México', 'apply_link': 'https://mx.trabajo.bz/view/7305560.html', 'is_direct': False}, {'publisher': 'JobLeads', 'apply_link': 'https://www.jobleads.com/mx/job/ee0baeb0111e9997261a16e90bf272220', 'is_direct': False}]","IT Infrastructure Solution Architect
Take your next career step at ABB with a global team that is energizing the transformation of society and industry to achieve a more productive, sustainable future.

At ABB, we have the clear goal of driving diversity and inclusion across all dimensions: gender, LGBTQ+, abilities, ethnicity and generations. Together, we are embarking on a journey where each and every one of us, individually and collectively, welcomes and celebrates individual differences.

This role involves responsibility for the design, integrity, and quality of an IS solution and of associated IS services delivered to business and support functions as well as IS Technology domains.
You will ensure that the solution/service provides the required functionality and meets cost expectations, while contributing to project set-up and delivery and to optimizing service operations.
This position reports to

IS Continuous Improvement Manager
Your responsibilities
• Deciding what is covered by available standard functionalities and where enhancements or workarounds are needed.
• Supporting validation and prioritization of business demand with the relevant IS Service Manager and/or Global IS Domain Architect, including signing off on use case specifications.
• Remaining current with new and emerging technology and industry practices, and bringing learning into ABB.
• Working with users in projects and problem management to maintain, develop and deploy solutions/services for the business.
• Ensuring that manuals and documentation are created to describe the operating procedures, and consulting on the installation of, or changes to, solutions/services.
• Contributing to results-oriented work with Information Systems architectural domains for various business processes and enterprise technology.
• Contributing to incident management to fight ticket volume by detecting and eliminating recurring defects and supporting issue resolution to avoid negative impact on a project or service.
• Supplying service managers with stakeholder information, and working with stakeholders regarding their expectations and requirements, in accordance with procedures and guidelines.
• Level 3 support of end users and services within the environment.

Your background
• Bachelor’s degree in Information Systems Infrastructure, Computer Science or similar or PMP Certification.
• 5 years of experience in IT infrastructure, working with servers, network, and applications.
• Excellent negotiation and presentation skills.
• Strong time management skills and flexibility necessary to handle periodic bursts of increased workload.
• Data analysis for requirements of the project work & deliverables.
• CCNA Certification preferred.
• Experience in Project Management is desirable.
• Availability to travel. Active Passport preferred.
• Advanced English level.

More about us

We look forward to receiving your application (documents submitted in English are appreciated). If you want to discover more about ABB, take another look at our website www.abb.com.
Work model: hybrid #LI-hybrid",False,1710979200,2024-03-21T00:00:00.000Z,San Luis Potosí,S.L.P.,MX,22.15209,-100.973305,,https://www.google.com/search?gl=us&hl=en&rciv=jb&q=software+infrastructure+architectin+mexico&start=0&ibp=htl;jobs#fpstate=tldetail&htivrt=jobs&htiq=software+infrastructure+architectin+mexico&htidocid=-zw2wyek8u6B3YbsAAAAAA%3D%3D,,,"{'no_experience_required': False, 'required_experience_in_months': 60, 'experience_mentioned': True, 'experience_preferred': False}",,"{'postgraduate_degree': False, 'professional_certification': False, 'high_school': False, 'associates_degree': False, 'bachelors_degree': False, 'degree_mentioned': True, 'degree_preferred': True, 'professional_certification_mentioned': True}",False,,,,,{},,en,15119900,4,['Informační systémy'],335311,"Power, Distribution, and Specialty Transformer Manufacturing"
