job_id,employer_name,employer_logo,employer_website,employer_company_type,job_publisher,job_employment_type,job_title,job_apply_link,job_apply_is_direct,job_apply_quality_score,apply_options,job_description,job_is_remote,job_posted_at_timestamp,job_posted_at_datetime_utc,job_city,job_state,job_country,job_latitude,job_longitude,job_benefits,job_google_link,job_offer_expiration_datetime_utc,job_offer_expiration_timestamp,job_required_experience,job_required_skills,job_required_education,job_experience_in_place_of_education,job_min_salary,job_max_salary,job_salary_currency,job_salary_period,job_highlights,job_job_title,job_posting_language,job_onet_soc,job_onet_job_zone,job_naics_code,job_naics_name,job_occupational_categories
T9mdXtenKxEYI9f3AAAAAA==,Thermo Fisher Scientific,https://upload.wikimedia.org/wikipedia/commons/thumb/5/50/Thermo_Fisher_Scientific_logo.svg/1200px-Thermo_Fisher_Scientific_logo.svg.png,https://www.thermofisher.com/us/en/home.html,Manufacturing,The Muse,FULLTIME,Quality Assurance Analyst,https://www.themuse.com/jobs/thermofisherscientific/quality-assurance-analyst-637ab9,False,0.5751,"[{'publisher': 'The Muse', 'apply_link': 'https://www.themuse.com/jobs/thermofisherscientific/quality-assurance-analyst-637ab9', 'is_direct': False}, {'publisher': 'OCCMundial', 'apply_link': 'https://www.occ.com.mx/empleo/oferta/18143894-quality-assurance-analyst/', 'is_direct': False}, {'publisher': 'Adzuna', 'apply_link': 'https://www.adzuna.com.mx/details/4632640046', 'is_direct': False}, {'publisher': 'BeBee México', 'apply_link': 'https://mx.bebee.com/job/125d67e2d83c0d7c83a8f231b21d2f6b', 'is_direct': False}, {'publisher': 'Talentify', 'apply_link': 'https://www.talentify.io/job/validation-analyst-mexico-city-mexico-city-thermo-fisher-scientific-tfscglobalr01218865externalenglobal', 'is_direct': False}, {'publisher': 'Recruit.net', 'apply_link': 'https://www.recruit.net/job/quality-assurance-analyst-jobs/6E2F985C9E933534', 'is_direct': False}, {'publisher': 'Expertini', 'apply_link': 'https://mx.expertini.com/jobs/job/quality-assurance-analyst-tlahuac-thermo-fisher-scient-99-4001168/', 'is_direct': False}]","Job Description

Are you ready to be a valued member within a Technology Centric Organization, surrounded by hard-working and driven individuals? Technology within the Contact Center space is evolving, and we are growing with it. Come join our team and be part of this exciting journey!

JOB DESCRIPTION:

In this position you will be part of our Governance, Risk & Compliance team (GRC). GRC is part of the larger Technical Operations group, who are responsible for the technology that supports or Medical Communications Contact Centers at PPD! To learn more about our Medical Communications team, visit our website: https://www.ppd.com/our-solutions/clinical/peri-and-post-approval/medical-communications/

As a Validation Analyst in the GRC department, your main role is to ensure adherence to the software development lifecycle for both new and existing systems and features. This includes collaborating closely with various teams to create and manage required documentation, developing test plans, and maintaining system compliance.

During a typical month, you will be responsible for reviewing requirements, PQ tests, validation documentation, and change controls and then presenting these documents for approval with the goal to move to the next project stage/implement into production.

Primary Accountabilities:
• Acting as a representative for validation at project team meetings and completing assigned action items.
• Assisting in the preparation and review of system documentation, such as requirements and design specifications for software systems.
• Participating in the identification of user requirements and system design.
• Preparing and obtaining approval of system and programming documentation.
• Recommending changes in development, maintenance, and system standards.
• Coordinating system upgrade activity.
• Accurately writing and executing test scripts to produce evidence that the computer system consistently performs its intended functions accurately and reliably.
• Creating, updating, and managing sufficient data within the testing environment to accurately test software functionality.

Job Qualification & Educational Experience
• Previous experience that provides the knowledge, skills, and abilities to perform the job (comparable to 2+ years
• Bachelor's degree or equivalent in technical subject area, Business, Science, equivalent work experience, and/or master's degree a plus
• Previous experience that provides the knowledge, skills, and abilities to perform the job (comparable to 4+ years).

Knowledge, skills and abilities:

We are looking for a strong standout candidate that can complement our current team, inspire change and build trust with key business partners and vendors.
• Excellent interpersonal skills, including communication, collaboration, and facilitation abilities across internal and external parties.
• Client-oriented mindset with strong communication skills, both written and verbal, and the ability to effectively teach others
• Positive attitude and dedication to delivering high-quality work
• Solid understanding of systems used at PPD or within the CRO/Pharmaceutical industry
• Meticulous attention to detail and strong problem-solving abilities
• Enthusiastic and able to work well in a team environment
• Good understanding of life sciences operational processes and terminology, as well as the software development life cycle (SDLC)
• Strong troubleshooting skills and the ability to analyze software defects, identify the cause of test failures, and explain error production
• Effective communication skills, both in conveying information and ideas clearly and in actively listening and understanding others
• Self-motivated and able to work independently with minimal guidance, while effectively managing work schedules to meet deadlines
• Ability to perform under pressure and multitask in a fast-paced environment

Diversity Statement
• PPD is proud to be an affirmative action employer that values diversity as a strength and fosters an environment of mutual respect. PPD is committed to providing equal employment opportunities without regard to age, race, color, pregnancy, national origin, religion, sex, gender identity, sexual orientation, disability, veteran status or status within any other protected group.",False,1712014758,2024-04-01T23:39:18.000Z,Ciudad de México,CDMX,MX,19.432608,-99.13321,,https://www.google.com/search?gl=us&hl=en&rciv=jb&q=software+quality+assurance+analysts+and+testersin+mexico&start=0&ibp=htl;jobs#fpstate=tldetail&htivrt=jobs&htiq=software+quality+assurance+analysts+and+testersin+mexico&htidocid=T9mdXtenKxEYI9f3AAAAAA%3D%3D,,,"{'no_experience_required': False, 'required_experience_in_months': None, 'experience_mentioned': True, 'experience_preferred': True}",,"{'postgraduate_degree': False, 'professional_certification': False, 'high_school': False, 'associates_degree': False, 'bachelors_degree': False, 'degree_mentioned': True, 'degree_preferred': False, 'professional_certification_mentioned': False}",False,,,,,{},Assurance analyst,en,19409900,3,334516,Analytical Laboratory Instrument Manufacturing,
BXvwDMA9NzfB9PBJAAAAAA==,Global Payments,https://www.globalpaymentsinc.com/-/media/global-payments/images/shared/globalpayments_wordmark_blue.png,http://www.globalpayments.com,Finance,Global Payments Careers,FULLTIME,"Analyst, Quality Assurance Tester",https://jobs.globalpayments.com/en/jobs/r0048466/analyst-quality-assurance-tester/,False,0.8954,"[{'publisher': 'Global Payments Careers', 'apply_link': 'https://jobs.globalpayments.com/en/jobs/r0048466/analyst-quality-assurance-tester/', 'is_direct': False}, {'publisher': 'LinkedIn', 'apply_link': 'https://mx.linkedin.com/jobs/view/analyst-quality-assurance-tester-at-global-payments-inc-3841327721', 'is_direct': False}, {'publisher': 'Indeed', 'apply_link': 'https://mx.indeed.com/viewjob?jk=e1ed614e778d449d', 'is_direct': False}, {'publisher': 'Glassdoor', 'apply_link': 'https://www.glassdoor.com.mx/job-listing/analyst-quality-assurance-tester-global-payments-JV_IC3517640_KO0,32_KE33,48.htm?jl=1009139151441', 'is_direct': False}, {'publisher': 'Jooble', 'apply_link': 'https://mx.jooble.org/jdp/5219080961912384481', 'is_direct': False}, {'publisher': 'Glassdoor', 'apply_link': 'https://www.glassdoor.com/job-listing/analyst-quality-assurance-tester-global-payments-JV_IC3517640_KO0,32_KE33,48.htm?jl=1009139151441', 'is_direct': False}, {'publisher': 'BeBee México', 'apply_link': 'https://mx.bebee.com/job/1021bede4c150ec890ad8fef0a69a154', 'is_direct': False}, {'publisher': 'Levels.fyi', 'apply_link': 'https://www.levels.fyi/jobs?jobId=83218213522809542', 'is_direct': False}]","EVO Payments, Inc. is a leading payment technology and services provider. EVO offers a number of innovative, reliable, and secure
payment solutions to merchants ranging from small and mid-size enterprises to multinational companies and organizations across the
globe with offices and multiple brands across the Americas, Europe, and China. As a fully integrated merchant acquirer and payment
processor in over 50 markets and 150 currencies worldwide, EVO provides competitive solutions that promote business growth,
increase customer loyalty, and enhance data security in the markets it serves.
EVO Payments in Mexico collaborates with Citibanamex and Banco Sabadell to provide merchant-acquiring services for their
customers.
Mexico City is the hub of our Product Development Center. This hub is responsible for the front and backend design, architecture and
development, and technical enhancements for all EVO Payments Products. Technology professionals, who join our center, get to work
on multiple projects that affect our customers, sales, call center representatives, and partners who rely on us to move money with
compliance and care in mind! As a professional, you get to sharpen your testing skills, and gain exposure to multiple systems. You will
also gain exposure to working with the network architecture, application design, business analysis, or technology project management
teams. Furthermore, you get to work in the heart of a growing Fintech company serving many customers throughout the world.
Whether your technology role is manual, automated, or cognitive, you hold a key role in releasing the best deliverables to all our EVO
Customers! Are you ready to grow your technology career?
About the role:
Tester QA will be responsible for the certification procedures and testing scripts execution that guarantees a satisfactory delivery of
solutions from EVO Mercury and E360 developments for Latin America..

Be a part of a team where you will:
 Define and Design Test Scripts by analyzing user requirements; envisioning system features and functionality.
 Completes applications testing by coordinating requirements, schedules, and activities; contributing to team meetings.
 Supports users by testing documentation and assistance tools.
 Contributing in all phases of the project lifecycle

About you:
 At least 1 years of experience certification stage processes, as well as in the operations of the payments industry.
 Bachelor's degree in Systems, truncated career in Electronic Engineering or related field, or equivalent experience in the
industry.
 Banking background desirable.
 Documenting software defects, using bug tracker tool and report defect to development team - JIRA
 Monitoring bug resolution efforts and tracking successes
 Analysis requirement
 Developing Testing programs such Test Plans, Test cases, software scenarios
 Desirable knowledge of communication protocols.
 Strong interpersonal and communications skills.
 Strong analytical and problem-solving skills.
 Self-starter attitude with initiative.
 Strong knowledge in excel, word, office in general.

What can EVO do for you?
Own your destiny with a worldwide payments industry leader where you can learn, grow, and advance
Enjoy a competitive salary and a comprehensive benefits package customized to the country in which you live
Thrive in a collaborative culture that supports innovation

Our people are the key to our success. Our commitment is to build a diverse, safe, and resilient culture that evolves with the needs of
our people and the communities in which we operate. We are dedicated to creating a workspace environment that provides a sense of
purpose for our people and supports each of us to learn, develop, and reach our full potential. Our culture and values are grounded in
service, integrity, diversity, teamwork, and taking ownership of our actions and reputation.
Disclaimer
The preceding position description has been designed to indicate the general nature and level of work performed by employees within
this classification. It is not designed to contain or be interpreted as a comprehensive inventory of all duties, responsibilities, and
qualifications required of employees assigned to this position.
EVO Payments Inc. is an equal opportunity employer committed to the hiring, advancement, and fair treatment of individuals without
regard to race, color, religion, gender, sexual preferences, age, national origin, ethnicity, disability or veteran status, or any other
protected status designated by federal, state, or local law.",False,1708560000,2024-02-22T00:00:00.000Z,Toluca de Lerdo,Méx.,MX,19.28261,-99.65566,,https://www.google.com/search?gl=us&hl=en&rciv=jb&q=software+quality+assurance+analysts+and+testersin+mexico&start=0&ibp=htl;jobs#fpstate=tldetail&htivrt=jobs&htiq=software+quality+assurance+analysts+and+testersin+mexico&htidocid=BXvwDMA9NzfB9PBJAAAAAA%3D%3D,,,"{'no_experience_required': False, 'required_experience_in_months': 12, 'experience_mentioned': True, 'experience_preferred': False}",,"{'postgraduate_degree': False, 'professional_certification': False, 'high_school': False, 'associates_degree': False, 'bachelors_degree': False, 'degree_mentioned': False, 'degree_preferred': True, 'professional_certification_mentioned': True}",False,,,,,{},Analyst,en,19409900,3,52232,"Financial Transactions Processing, Reserve, and Clearinghouse Activities",
dXVefYhQXncnRw5-AAAAAA==,SWBC Mexico,https://upload.wikimedia.org/wikipedia/commons/b/bf/SWBC_Logo.png,https://www.swbc.com,Finance,LinkedIn,FULLTIME,Software Quality Assurance Analyst,https://mx.linkedin.com/jobs/view/software-quality-assurance-analyst-at-swbc-mexico-3829148172,False,0.7725,"[{'publisher': 'LinkedIn', 'apply_link': 'https://mx.linkedin.com/jobs/view/software-quality-assurance-analyst-at-swbc-mexico-3829148172', 'is_direct': False}]","SWBC is seeking a talented individual to plan, create, and execute test plans. This role reviews test results to detect and accurately report problems found during testing. This individual contributes to defining testing scope and identifying regression opportunities. This role collaborates, communicates, and executes testing efforts in a dynamic environment, participating as a key member.

Why you'll love this role:

In this role, you will join a friendly and diverse group of professional SQA Analysts that work within an enterprise-level Agile environment creating and executing test cases for financial applications and their APIs. SWBC utilizes cutting edge technical tools and offers continued growth in software testing and Agile SDLC practices.

Essential duties include the following:
• Designs and creates test plans based on requirements.
• Executes tests, audits and reports problems found, and accurately document results.
• Updates and enhances test suites and test methods in order to improve the validation of changes to products.
• Creates and maintains test data in assigned environment using established Quality Assurance (QA) tools.
• Defines risks that may impact the schedule. Suggests actions to eliminate or mitigate risks.
• Provides clear and concise project and test documentation.
• Contributes to specification, test case, and test plan reviews.
• Participates in documentation, development, and improvement of processes and procedures. Leverages other project team expertise to solve problems. Assists others in areas of expertise.
• Performs all other duties as assigned.

Serious candidates will possess the minimum qualifications:
• Bachelor’s Degree in Computer Science or equivalent experience required.
• Minimum of two (2) years of data management/ administration, preferable in a secured technical environment
• International Software Testing Qualification Board (ISTQB) certification preferred.
• Working knowledge of Power 9, Structured Query Language (SQL), and Azure DevOps
• Working knowledge of defect reporting tools and test management.
• Working knowledge of computer science, database, and quality assurance.
• Working knowledge of a set of industry standard testing tools.
• Proficient Microsoft Office skills, including Outlook, Word, and Excel.
• Excellent multi-tasking skills.
• Excellent organizational skills.
• Excellent verbal and written communication skills.
• Able to work under limited supervision (self-motivation, self-initiative).
• Able to identify and isolate problems within area of responsibility.
• Able to solve moderate technical issues in one or more areas.
• Able to work through a full development lifecycle in area of responsibility.
• Able to travel locally or nationally by car or plane.",False,1710175360,2024-03-11T16:42:40.000Z,Monterrey,N.L.,MX,25.686615,-100.31612,,https://www.google.com/search?gl=us&hl=en&rciv=jb&q=software+quality+assurance+analysts+and+testersin+mexico&start=0&ibp=htl;jobs#fpstate=tldetail&htivrt=jobs&htiq=software+quality+assurance+analysts+and+testersin+mexico&htidocid=dXVefYhQXncnRw5-AAAAAA%3D%3D,2024-04-16T19:55:30.000Z,1713297330.0,"{'no_experience_required': False, 'required_experience_in_months': None, 'experience_mentioned': True, 'experience_preferred': False}",,"{'postgraduate_degree': False, 'professional_certification': False, 'high_school': False, 'associates_degree': False, 'bachelors_degree': True, 'degree_mentioned': True, 'degree_preferred': True, 'professional_certification_mentioned': True}",False,,,,,{},,en,15119900,4,52412,"Direct Insurance (except Life, Health, and Medical) Carriers",
