job_id,employer_name,employer_logo,employer_website,employer_company_type,job_publisher,job_employment_type,job_title,job_apply_link,job_apply_is_direct,job_apply_quality_score,apply_options,job_description,job_is_remote,job_posted_at_timestamp,job_posted_at_datetime_utc,job_city,job_state,job_country,job_latitude,job_longitude,job_benefits,job_google_link,job_offer_expiration_datetime_utc,job_offer_expiration_timestamp,job_required_experience,job_required_skills,job_required_education,job_experience_in_place_of_education,job_min_salary,job_max_salary,job_salary_currency,job_salary_period,job_highlights,job_job_title,job_posting_language,job_onet_soc,job_onet_job_zone,job_naics_code,job_naics_name,job_occupational_categories
IdNHPpmaYqGEndwaAAAAAA==,Tiger Text,https://tigerconnect.com/wp-content/uploads/2018/02/TigerConnect-full-color-tm-logo.svg,http://tigerconnect.com,Information,BeBee México,FULLTIME,Insurance IT Quality Sr Analyst,https://mx.bebee.com/job/97ad87702367f4cf2f83a2a61c37f6ef,False,0.5529,"[{'publisher': 'BeBee México', 'apply_link': 'https://mx.bebee.com/job/97ad87702367f4cf2f83a2a61c37f6ef', 'is_direct': False}, {'publisher': 'Trabajo.org - Vacantes De Empleo, Trabajo', 'apply_link': 'https://mx.trabajo.org/oferta-1270-20240323-f5f1ff8952bc255c006b625e9c7f572f', 'is_direct': False}]","The IT Quality Sr Analyst is a seasoned professional role. Applies in-depth disciplinary knowledge, contributing to the development of new techniques and the improvement of processes and work-flow for the area or function.

Integrates subject matter and industry expertise within a defined area. Requires in-depth understanding of how areas collectively integrate within the sub-function as well as coordinate and contribute to the objectives of the function and overall business.

Evaluates moderately complex and variable issues with substantial potential impact, where development of an approach / taking of an action involves weighing various alternatives and balancing potentially conflicting situations using multiple sources of information.

Requires good analytical skills in order to filter, prioritize and validate potentially complex and dynamic material from multiple sources.

Strong communication and diplomacy skills are required. Regularly assumes informal / formal leadership role within teams.

Involved in coaching and training of new recruits Significant impact in terms of project size, geography, etc. by influencing decisions through advice, counsel and / or facilitating services to others in area of specialization.

Work and performance of all teams in the area are directly affected by the performance of the individual.

Responsibilities :

Responsible for initiatives related to User Acceptance Testing (UAT) process and product rollout into production, making recommendations of solutions and improvements.

Responsibilities may also include software quality assurance testing.
• Conducts complex process monitoring, product evaluation and audit assignments; reports issues and makes recommendations for solutions.
• Ensures project standards and procedures exist, are fully / clearly documented and followed throughout the software development life cycle;

makes recommendations for enhanced documentation.

Monitors products for conformance to standards; monitors processes for conformance to procedures; identifies risks and recommends solutions;

ensures annual organizational reviews of standards and procedures are conducted.

Documents findings and performs root cause analyses to provide recommended improvements. Independently recommends solutions and improvements to existing standards and procedures;

collaborates with other areas in technology to develop new standards and procedures.

Ensures all corrective actions are assigned, documented and completed. Verifies traceability in project work products.

Gathers, maintains and creates reports on quality metrics.
• Exhibits sound understanding of concepts and principles in own technical area and a basic knowledge of these elements in other areas.
• Requires in-depth understanding of how own area integrates within IT Quality and has basic commercial awareness.
• Acts as advisor and mentor for junior members of the team.
• Makes evaluative judgments based on analysis of factual information in complicated and novel situations and provides solutions to problems.
• Has direct impact on the team and closely related teams by ensuring the quality of the tasks / services / information provided by self and others.
• Requires sound and comprehensive communication and diplomacy skills to exchange complex information.
• Performs other duties and functions as assigned.
• Appropriately assess risk when business decisions are made, demonstrating particular consideration for the firm's reputation and safeguarding Citigroup, its clients and assets, by driving compliance with applicable laws, rules and regulations, adhering to Policy, applying sound ethical judgment regarding personal behavior, conduct and business practices, and escalating, managing and reporting control issues with transparency.

Qualifications :
• 5-8 years experience in an IT Quality role.
• Demonstrated execution capabilities.
• Development experience in a fast-paced, time-to-market driven environment Experience with test automation, test scenario and test scripts creation and modification Comfortable with writing complex queries Experience with reporting tools.

Hands on experience with testing automation tools.

Education :

Bachelor's / University degree or equivalent experience

Job Family Group : Technology

Technology

Job Family : Technology Quality

Time Type : Full time

Full time

Citi is an equal opportunity and affirmative action employer.

Qualified applicants will receive consideration without regard to their race, color, religion, sex, sexual orientation, gender identity, national origin, disability, or status as a protected veteran.

Citigroup Inc. and its subsidiaries (""Citi ) invite all qualified interested applicants to apply for career opportunities.

If you are a person with a disability and need a reasonable accommodation to use our search tools and / or apply for a career opportunity review .

It 's why we work with some of the world's leading creators to produce and share audio storytelling with our Support Engineering Program you'll be driving complex and impactful initiatives that improve the quality We're obsessed with our customers, so it 's important that you dream big. designing and building features At work, change is the only constant. and you wouldn't have it any other way. You see the bigger picture, letting it guide you, from project risks to retrospectives.

Further, it includes working with vendors and HR to ensure supplier services are adequately governed and execution of local HR controls to demonstrate and ensure adherence to local employment laws and quality

The IT Quality Sr Analyst is a seasoned professional role. Responsibilities may also include software quality assurance testing.Conducts complex process monitoring Gathers, maintains and creates reports on quality metrics.Exhibits sound understanding of concepts and of these elements in other areas.Requires in depth understanding of how own area integrates within IT managing and reporting control issues with transparency.Qualifications 5 8 years experience in an IT

Alia, an IT consultancy with over 25 years in the market, is hiring SR DATA ANALYSTRequirements and necessary experience. Senior Data Analyst Consultant with a strong background in commercial data quality projects años de experienciaIdiomas. Inglés Edad. A partir de 25 añosPalabras clave. datos, analistaAlia, an IT consultancy with over 25 years in the market, is hiring SR DATA ANALYSTRequirements and necessary experience Senior Data Analyst Consultant with a strong background in commercial data quality projects within

Discovery Seeks a Sr . Financial Analyst for the Resource Planning C&B department. The Sr . month end close activities, develop ad hoc reports and provide high quality financial information and Additionally, the Sr . Business analyst or financial analyst experience a plus.

Company DescriptionLocation. Mexico CityModality. HybridREFID467555Job DescriptionAbout the RoleThe Sr study issues, and develop standard processes for new services and tools.PurposeEnsures that Client and Analyst studies.ResponsibilitiesSchedules studies in WB.Develops questionnaires starting with content information from analyst .Checks influence, collaborate and negotiate to attain alignment across teams.Additional InformationWhat's in it committees for developing soft skills and expand your work network.Continuous learning and growth.Local insurance

AIG) is a leading global insurance organization. is a leading provider of insurance products and services for commercial and personal insurance customers It includes one of the world's most far reaching property casualty networks. reports to the Country Head of Claims.The Claims Complex Dir Sr is in charge and leads the Commercial It is an exciting time to join us. across our operations, we are thinking in new and innovative ways

An HR Shared Service Analyst is part of a particular process team within a function and focuses on delivering Leads internal and cross functional initiatives related to process and quality improvement.

It started with one ridiculously good idea. Create a different breed of BPO a moment's notice, mastering consistency in an ever changing world. that's what it Full Medical, Dental, Vision, and Life Insurance for you and your dependents above and beyond what is
#J-18808-Ljbffr",False,1712125827,2024-04-03T06:30:27.000Z,Ciudad de México,CDMX,MX,19.432608,-99.13321,,https://www.google.com/search?gl=us&hl=en&rciv=jb&q=software+quality+assurance+analysts+and+testersin+mexico&start=30&ibp=htl;jobs#fpstate=tldetail&htivrt=jobs&htiq=software+quality+assurance+analysts+and+testersin+mexico&htidocid=IdNHPpmaYqGEndwaAAAAAA%3D%3D,2024-04-11T00:00:00.000Z,1712793600.0,"{'no_experience_required': False, 'required_experience_in_months': 60, 'experience_mentioned': True, 'experience_preferred': True}",,"{'postgraduate_degree': False, 'professional_certification': False, 'high_school': False, 'associates_degree': False, 'bachelors_degree': False, 'degree_mentioned': True, 'degree_preferred': False, 'professional_certification_mentioned': False}",False,,,,,{},Sr analyst,en,19409900,3,511210,Software Publishers,
eBVIqfl9rjIPoM0_AAAAAA==,Cognizant Technology Solutions,https://news.cognizant.com/images/COG-Logo.svg,http://www.cognizant.com,Computer Services,Cognizant Careers,FULLTIME,QA Voice Specialist,https://careers.cognizant.com/professionals/global/en/job/43478/QA-Voice-Specialist,False,0.8912,"[{'publisher': 'Cognizant Careers', 'apply_link': 'https://careers.cognizant.com/professionals/global/en/job/43478/QA-Voice-Specialist', 'is_direct': False}, {'publisher': 'LinkedIn', 'apply_link': 'https://mx.linkedin.com/jobs/view/qa-voice-specialist-at-cognizant-3793553789', 'is_direct': False}, {'publisher': 'Indeed', 'apply_link': 'https://mx.indeed.com/viewjob?jk=21836d59a0f5e506', 'is_direct': False}, {'publisher': 'SimplyHired', 'apply_link': 'https://www.simplyhired.mx/job/mL4zcR5_NB4dn4fwmW-wS1nVwuevG9XmRaueklqYnmXl6gT83a5AVQ', 'is_direct': False}, {'publisher': 'BeBee México', 'apply_link': 'https://mx.bebee.com/job/51a1cd9b2312b3c8b026cdbaa5634b53', 'is_direct': False}, {'publisher': 'Levels.fyi', 'apply_link': 'https://www.levels.fyi/jobs?jobId=94313233424229062', 'is_direct': False}, {'publisher': 'Talentify', 'apply_link': 'https://www.talentify.io/job/qa-voice-specialist-job-number-43478-guadalajara-jalisco-cognizant-2189277', 'is_direct': False}, {'publisher': 'MX Talent', 'apply_link': 'https://mx.talent.com/view?id=c6406a31b67b', 'is_direct': False}]","Cognizant is always looking for top talent. We are searching for candidates to fill future needs within the business. This job posting represents potential future employment opportunities with Cognizant. Although the position is not currently available, we want to provide you with the opportunity to express your interest in future employment opportunities with Cognizant. If a job opportunity that you may be qualified for becomes available in the future, we will notify you. At that time you can determine whether you would like to apply for the specific open position. Thank you for your interest in Cognizant career opportunities.

We’re hiring!

At Cognizant we have an ideal opportunity for you to be part of one of the largest companies in the digital sector worldwide. A Great Place To Work where we look for people who contribute new ideas, experiencing a dynamic and growing environment. At Cognizant we promote an inclusive culture, where we value different perspectives providing career growth and development opportunities. #WelcomeToCognizant!

We have an exciting opportunity for an exceptional individual to work supporting one of our clients as a QA Voice Specialist

What you’ll do:

Parameters/checklists on a random sample picked for audit in an unbiased manner.

Evaluate/score each transaction and provide DPO (Defects per Opportunity) or DPU (Defects per Unit) score to the agent/associate.

Mentor and Counsel the associate on the areas of improvement. Ability to resolve conflicts from a QA standpoint and passionate about helping others achieve results.

Position may have up to 80% phone time depending on volumes and business needs.

Preferred experience:

2 to 3 years working in a service/customer service/sales/ call center organization.

Advanced English Level.

A minimum of one 1 year in a Quality auditor role.

Excellent communication skills – written and oral.

High school degree or equivalent.

Client-focused and solutions-oriented; Good problem-solving and analytical skills. Ability to use judgment to help analysts apply the most appropriate solution for complex client situations.

Ability to work with both internal and client teams.

Categorization of errors and report them to management (Apply 80-20 principle and report the 20% (or Top 5) errors causing a major number of defects.

Work with the Supervisors on the RCA (Root cause Analysis) and improvement plans

Organize training sessions for the team to mitigate the defects.

Create awareness programs on the floor by sending mailers/teasers and running competitions on the floor.

Report the audit findings, RCA’s, and improvement plans to the management on a daily/weekly/monthly basis or as and when required.

Flexibility to work in shifts and weekends (if the business demands).

Why Cognizant?

Improve your career in one of the largest and fastest growing IT services providers worldwide

Receive ongoing support and funding with training and development plans

Have a highly competitive benefits and salary package

Get the opportunity to work for leading global companies

We are committed to respecting human rights and build a better future by helping your minds and the environment

We invest in people and their wellbeing.

We create conditions for everyone to thrive. We do not discriminate based on race, religion, color, sex, age, disability, nationality, sexual orientation, gender identity or expression, or for any other reason covered.

At Cognizant we believe than our culture make us stronger!

Join us now!

#BeCognizant #IntuitionEngineered",False,1704326400,2024-01-04T00:00:00.000Z,Guadalajara,Jal.,MX,20.67517,-103.347336,,https://www.google.com/search?gl=us&hl=en&rciv=jb&q=software+quality+assurance+analysts+and+testersin+mexico&start=30&ibp=htl;jobs#fpstate=tldetail&htivrt=jobs&htiq=software+quality+assurance+analysts+and+testersin+mexico&htidocid=eBVIqfl9rjIPoM0_AAAAAA%3D%3D,,,"{'no_experience_required': False, 'required_experience_in_months': 24, 'experience_mentioned': True, 'experience_preferred': False}",,"{'postgraduate_degree': False, 'professional_certification': False, 'high_school': False, 'associates_degree': False, 'bachelors_degree': False, 'degree_mentioned': False, 'degree_preferred': False, 'professional_certification_mentioned': False}",False,,,,,{},Specialist,en,19409900,3,541511,Custom Computer Programming Services,['Consulting']
yOLTL-W3B1vjYdpIAAAAAA==,Citi,https://upload.wikimedia.org/wikipedia/commons/thumb/1/1b/Citi.svg/200px-Citi.svg.png,http://www.citigroup.com,Finance,Jobs And Careers At Citi,FULLTIME,Insurance IT Quality Senior Manager,https://jobs.citi.com/job/ciudad-de-mexico/insurance-it-quality-senior-manager/287/62450673952,False,0.8991,"[{'publisher': 'Jobs And Careers At Citi', 'apply_link': 'https://jobs.citi.com/job/ciudad-de-mexico/insurance-it-quality-senior-manager/287/62450673952', 'is_direct': False}, {'publisher': 'Indeed', 'apply_link': 'https://mx.indeed.com/viewjob?jk=a9f09044d1dbef2e', 'is_direct': False}, {'publisher': 'Adzuna', 'apply_link': 'https://www.adzuna.com.mx/details/4607124672', 'is_direct': False}, {'publisher': 'OCCMundial', 'apply_link': 'https://www.occ.com.mx/empleo/oferta/18254908-insurance-it-quality-senior-manager/', 'is_direct': False}, {'publisher': 'SimplyHired', 'apply_link': 'https://www.simplyhired.mx/job/HJgkw7ykqTvkLjkJgnIrNFA5LjUqx3ZwyHwvGN50ZmFFBcm0ugQRLg', 'is_direct': False}, {'publisher': 'BeBee México', 'apply_link': 'https://mx.bebee.com/job/388ba2d9163300fc2dc442dfd43cf9c2', 'is_direct': False}, {'publisher': 'Trabajo.org - Vacantes De Empleo, Trabajo', 'apply_link': 'https://mx.trabajo.org/oferta-1813-20240312-1183e97ad4a198a98385708a8414e929', 'is_direct': False}, {'publisher': 'Expertini', 'apply_link': 'https://mx.expertini.com/jobs/job/insurance-it-quality-senior-manager-mexico-city-09501-citibanamex-se-78519dfac3/', 'is_direct': False}]","The IT Quality Senior Manager accomplishes results through the management of professional team(s) and department(s). Integrates subject matter and industry expertise within a defined area. Contributes to standards around which others will operate. Requires in-depth understanding of how areas collectively integrate within the sub-function as well as coordinate and contribute to the objectives of the entire function. Requires basic commercial awareness. Developed communication and diplomacy skills are required in order to guide, influence and convince others, in particular colleagues in other areas and occasional external customers. Has responsibility for volume, quality, timeliness and delivery of end results of an area. May have responsibility for planning, budgeting and policy formulation within area of expertise. Involved in short-term planning resource planning. Full management responsibility of a team, which may include management of people, budget and planning, to include duties such as performance evaluation, compensation, hiring, disciplinary and terminations and may include budget approval.

Responsibilities:
• Performs initiatives related to User Acceptance Testing (UAT) process and product rollout into production. Testing specialists who work with technology project managers, UAT professionals and users to design and implement appropriate scripts/plans for an application testing strategy/approach. Responsibilities may also include software quality assurance testing.
• Manages multiple IT Quality teams or an IT Quality functional area (depending on size of business).
• Resolves complex and highly variable issues.
• Analyzes trends at an organizational level to improve processes; follows and analyzes industry trends.
• Develops and designs standards and procedures; ensures that they are adhered to throughout the software development life cycle.
• Manages organizational process change.
• Develops and implements methods for cost, effort and milestones of IT Quality activities. Strives for continuous improvements and streamlining of processes.
• Ensures consistency and quality of processes across the organization. Exhibits in-depth understanding of concepts and procedures within own area and basic knowledge of these elements in other areas.
• Requires in-depth understanding of how own area integrates within IT Quality and has basic commercial awareness.
• Evaluates subordinates' performance and makes decisions on pay increases, promotions, terminations, etc.
• Uses evaluative judgment in complicated or novel situations; uses multiple sources of information.
• Impacts IT Quality through delivery of end results and contribution to planning, finances/budget and formulation of policies.
• Responsible for budgeting, project estimates, task management & balancing prioritization across multiple streams of development
• Responsible for people management, mentoring and career development process for Shanghai team including delivering performance review, training, recruiting.
• Collaborates with local and global stakeholders like QA team, production support team, environment management team, DBA team, etc. to ensure project stability and productivity.
• Responsible for handling day-to-day staff management issues, including resource management and allocation of work within the team/project.
• Performs other duties and functions as assigned.
• Appropriately assess risk when business decisions are made, demonstrating particular consideration for the firm's reputation and safeguarding Citigroup, its clients and assets, by driving compliance with applicable laws, rules and regulations, adhering to Policy, applying sound ethical judgment regarding personal behavior, conduct and business practices, and escalating, managing and reporting control issues with transparency, as well as effectively supervise the activity of others and create accountability with those who fail to maintain these standards.

Qualifications:
• 6-10 years IT Testing experience required
• Excellent knowledge of software testing techniques and testing tools
• Knowledge of any well-known software development and testing life-cycle methodology
• Requires communication and diplomacy skills and an ability to persuade and influence

Education:
• Bachelor’s/University degree, Master’s degree preferred

Qualifications

- Desirable 3-5 years experience in the Insurance Business

- Knowledge in AML and testing.

- Intermediate english

------------------------------------------------------

Job Family Group:
Technology

------------------------------------------------------

Job Family:
Technology Quality

------------------------------------------------------

Time Type:
Full time

------------------------------------------------------

Citi is an equal opportunity and affirmative action employer.

Qualified applicants will receive consideration without regard to their race, color, religion, sex, sexual orientation, gender identity, national origin, disability, or status as a protected veteran.

Citigroup Inc. and its subsidiaries (""Citi”) invite all qualified interested applicants to apply for career opportunities. If you are a person with a disability and need a reasonable accommodation to use our search tools and/or apply for a career opportunity review Accessibility at Citi.

View the ""EEO is the Law"" poster. View the EEO is the Law Supplement.

View the EEO Policy Statement.

View the Pay Transparency Posting",False,1709856000,2024-03-08T00:00:00.000Z,Ciudad de México,CDMX,MX,19.432608,-99.13321,,https://www.google.com/search?gl=us&hl=en&rciv=jb&q=software+quality+assurance+analysts+and+testersin+mexico&start=40&ibp=htl;jobs#fpstate=tldetail&htivrt=jobs&htiq=software+quality+assurance+analysts+and+testersin+mexico&htidocid=yOLTL-W3B1vjYdpIAAAAAA%3D%3D,,,"{'no_experience_required': False, 'required_experience_in_months': 72, 'experience_mentioned': True, 'experience_preferred': False}",,"{'postgraduate_degree': False, 'professional_certification': False, 'high_school': False, 'associates_degree': False, 'bachelors_degree': False, 'degree_mentioned': True, 'degree_preferred': False, 'professional_certification_mentioned': False}",False,,,,,{},Senior manager,en,11305100,4,522110,Commercial Banking,
